Sheet: Categories
A1: Level | B1: Count | C1: Category | D1: Slug | E1: HtmlPath | F1: 2.5*Log10(Count+2) | G1: RelativeCount | H1: SRC1=7*RC | I1: SRC2=RC*10000 | J1: Log10(SRC2) | K1: 1.75*Log10(SRC2) | L1: 11*Log10(Log10(SRC2))
A2: -1 | B2: -1 | C2: Select Category | D2: select-category | F2: =2.5*LOG10(RC[-4]+2) -> 0 | G2: =ABS(RC[-5])/MAX(C[-5]) -> 2.0746887966804979E-3 | H2: =7*RC[-1] -> 1.4522821576763486E-2 | I2: =10000*RC[-2] -> 20.74688796680498 | J2: =LOG10(RC[-1]) -> 1.3169529617611504 | K2: =1.75*RC[-1] -> 2.3046676830820134 | L2: =11*LOG10(RC[-2]) -> 1.3152728966856806
A3: 2 | B3: 1 | C3: Curatele | D3: curatele | E3: /about/personal/curatele | F3: =2.5*LOG10(RC[-4]+2) -> 1.1928031367991561 | G3: =ABS(RC[-5])/MAX(C[-5]) -> 2.0746887966804979E-3 | H3: =7*RC[-1] -> 1.4522821576763486E-2 | I3: =10000*RC[-2] -> 20.74688796680498 | J3: =LOG10(RC[-1]) -> 1.3169529617611504 | K3: =1.75*RC[-1] -> 2.3046676830820134 | L3: =11*LOG10(RC[-2]) -> 1.3152728966856806
A4: 2 | B4: 1 | C4: Photography | D4: photography | E4: /about/personal/photography | F4: =2.5*LOG10(RC[-4]+2) -> 1.1928031367991561 | G4: =ABS(RC[-5])/MAX(C[-5]) -> 2.0746887966804979E-3 | H4: =7*RC[-1] -> 1.4522821576763486E-2 | I4: =10000*RC[-2] -> 20.74688796680498 | J4: =LOG10(RC[-1]) -> 1.3169529617611504 | K4: =1.75*RC[-1] -> 2.3046676830820134 | L4: =11*LOG10(RC[-2]) -> 1.3152728966856806
A5: 3 | B5: 1 | C5: SQL Server 2005 | D5: sql-server-2005 | E5: /development/database-development/sql-server/sql-server-2005 | F5: =2.5*LOG10(RC[-4]+2) -> 1.1928031367991561 | G5: =ABS(RC[-5])/MAX(C[-5]) -> 2.0746887966804979E-3 | H5: =7*RC[-1] -> 1.4522821576763486E-2 | I5: =10000*RC[-2] -> 20.74688796680498 | J5: =LOG10(RC[-1]) -> 1.3169529617611504 | K5: =1.75*RC[-1] -> 2.3046676830820134 | L5: =11*LOG10(RC[-2]) -> 1.3152728966856806
A6: 3 | B6: 1 | C6: SQL Server 2008 R2 | D6: sql-server-2008-r2 | E6: /development/database-development/sql-server/sql-server-2008-r2 | F6: =2.5*LOG10(RC[-4]+2) -> 1.1928031367991561 | G6: =ABS(RC[-5])/MAX(C[-5]) -> 2.0746887966804979E-3 | H6: =7*RC[-1] -> 1.4522821576763486E-2 | I6: =10000*RC[-2] -> 20.74688796680498 | J6: =LOG10(RC[-1]) -> 1.3169529617611504 | K6: =1.75*RC[-1] -> 2.3046676830820134 | L6: =11*LOG10(RC[-2]) -> 1.3152728966856806
A7: 3 | B7: 1 | C7: SQL Server 2012 | D7: sql-server-2012 | E7: /development/database-development/sql-server/sql-server-2012 | F7: =2.5*LOG10(RC[-4]+2) -> 1.1928031367991561 | G7: =ABS(RC[-5])/MAX(C[-5]) -> 2.0746887966804979E-3 | H7: =7*RC[-1] -> 1.4522821576763486E-2 | I7: =10000*RC[-2] -> 20.74688796680498 | J7: =LOG10(RC[-1]) -> 1.3169529617611504 | K7: =1.75*RC[-1] -> 2.3046676830820134 | L7: =11*LOG10(RC[-2]) -> 1.3152728966856806
A8: 3 | B8: 1 | C8: SQL Server 7 | D8: sql-server-7 | E8: /development/database-development/sql-server/sql-server-7 | F8: =2.5*LOG10(RC[-4]+2) -> 1.1928031367991561 | G8: =ABS(RC[-5])/MAX(C[-5]) -> 2.0746887966804979E-3 | H8: =7*RC[-1] -> 1.4522821576763486E-2 | I8: =10000*RC[-2] -> 20.74688796680498 | J8: =LOG10(RC[-1]) -> 1.3169529617611504 | K8: =1.75*RC[-1] -> 2.3046676830820134 | L8: =11*LOG10(RC[-2]) -> 1.3152728966856806
A9: 1 | B9: 1 | C9: EPS/PostScript | D9: eps-postscript | E9: /development/eps-postscript | F9: =2.5*LOG10(RC[-4]+2) -> 1.1928031367991561 | G9: =ABS(RC[-5])/MAX(C[-5]) -> 2.0746887966804979E-3 | H9: =7*RC[-1] -> 1.4522821576763486E-2 | I9: =10000*RC[-2] -> 20.74688796680498 | J9: =LOG10(RC[-1]) -> 1.3169529617611504 | K9: =1.75*RC[-1] -> 2.3046676830820134 | L9: =11*LOG10(RC[-2]) -> 1.3152728966856806
A10: 1 | B10: 1 | C10: Hardware Development | D10: hardware-development | E10: /development/hardware-development | F10: =2.5*LOG10(RC[-4]+2) -> 1.1928031367991561 | G10: =ABS(RC[-5])/MAX(C[-5]) -> 2.0746887966804979E-3 | H10: =7*RC[-1] -> 1.4522821576763486E-2 | I10: =10000*RC[-2] -> 20.74688796680498 | J10: =LOG10(RC[-1]) -> 1.3169529617611504 | K10: =1.75*RC[-1] -> 2.3046676830820134 | L10: =11*LOG10(RC[-2]) -> 1.3152728966856806
A11: 3 | B11: 1 | C11: Servo | D11: servo | E11: /development/hardware-interfacing/usb/servo | F11: =2.5*LOG10(RC[-4]+2) -> 1.1928031367991561 | G11: =ABS(RC[-5])/MAX(C[-5]) -> 2.0746887966804979E-3 | H11: =7*RC[-1] -> 1.4522821576763486E-2 | I11: =10000*RC[-2] -> 20.74688796680498 | J11: =LOG10(RC[-1]) -> 1.3169529617611504 | K11: =1.75*RC[-1] -> 2.3046676830820134 | L11: =11*LOG10(RC[-2]) -> 1.3152728966856806
A12: 3 | B12: 1 | C12: WebCam | D12: webcam | E12: /development/hardware-interfacing/usb/webcam | F12: =2.5*LOG10(RC[-4]+2) -> 1.1928031367991561 | G12: =ABS(RC[-5])/MAX(C[-5]) -> 2.0746887966804979E-3 | H12: =7*RC[-1] -> 1.4522821576763486E-2 | I12: =10000*RC[-2] -> 20.74688796680498 | J12: =LOG10(RC[-1]) -> 1.3169529617611504 | K12: =1.75*RC[-1] -> 2.3046676830820134 | L12: =11*LOG10(RC[-2]) -> 1.3152728966856806
A13: 2 | B13: 1 | C13: Android | D13: android | E13: /development/mobile-development/android | F13: =2.5*LOG10(RC[-4]+2) -> 1.1928031367991561 | G13: =ABS(RC[-5])/MAX(C[-5]) -> 2.0746887966804979E-3 | H13: =7*RC[-1] -> 1.4522821576763486E-2 | I13: =10000*RC[-2] -> 20.74688796680498 | J13: =LOG10(RC[-1]) -> 1.3169529617611504 | K13: =1.75*RC[-1] -> 2.3046676830820134 | L13: =11*LOG10(RC[-2]) -> 1.3152728966856806
A14: 2 | B14: 1 | C14: iOS Development | D14: ios-development | E14: /development/mobile-development/ios-development | F14: =2.5*LOG10(RC[-4]+2) -> 1.1928031367991561 | G14: =ABS(RC[-5])/MAX(C[-5]) -> 2.0746887966804979E-3 | H14: =7*RC[-1] -> 1.4522821576763486E-2 | I14: =10000*RC[-2] -> 20.74688796680498 | J14: =LOG10(RC[-1]) -> 1.3169529617611504 | K14: =1.75*RC[-1] -> 2.3046676830820134 | L14: =11*LOG10(RC[-2]) -> 1.3152728966856806
A15: 2 | B15: 1 | C15: Windows CE | D15: windows-ce | E15: /development/mobile-development/windows-ce | F15: =2.5*LOG10(RC[-4]+2) -> 1.1928031367991561 | G15: =ABS(RC[-5])/MAX(C[-5]) -> 2.0746887966804979E-3 | H15: =7*RC[-1] -> 1.4522821576763486E-2 | I15: =10000*RC[-2] -> 20.74688796680498 | J15: =LOG10(RC[-1]) -> 1.3169529617611504 | K15: =1.75*RC[-1] -> 2.3046676830820134 | L15: =11*LOG10(RC[-2]) -> 1.3152728966856806
A16: 2 | B16: 1 | C16: Windows Phone Development | D16: windows-phone-development | E16: /development/mobile-development/windows-phone-development | F16: =2.5*LOG10(RC[-4]+2) -> 1.1928031367991561 | G16: =ABS(RC[-5])/MAX(C[-5]) -> 2.0746887966804979E-3 | H16: =7*RC[-1] -> 1.4522821576763486E-2 | I16: =10000*RC[-2] -> 20.74688796680498 | J16: =LOG10(RC[-1]) -> 1.3169529617611504 | K16: =1.75*RC[-1] -> 2.3046676830820134 | L16: =11*LOG10(RC[-2]) -> 1.3152728966856806
A17: 3 | B17: 1 | C17: .NET 4.5 | D17: net-4-5 | E17: /development/software-development/net/net-4-5 | F17: =2.5*LOG10(RC[-4]+2) -> 1.1928031367991561 | G17: =ABS(RC[-5])/MAX(C[-5]) -> 2.0746887966804979E-3 | H17: =7*RC[-1] -> 1.4522821576763486E-2 | I17: =10000*RC[-2] -> 20.74688796680498 | J17: =LOG10(RC[-1]) -> 1.3169529617611504 | K17: =1.75*RC[-1] -> 2.3046676830820134 | L17: =11*LOG10(RC[-2]) -> 1.3152728966856806
A18: 3 | B18: 1 | C18: .NET CF | D18: net-cf | E18: /development/software-development/net/net-cf | F18: =2.5*LOG10(RC[-4]+2) -> 1.1928031367991561 | G18: =ABS(RC[-5])/MAX(C[-5]) -> 2.0746887966804979E-3 | H18: =7*RC[-1] -> 1.4522821576763486E-2 | I18: =10000*RC[-2] -> 20.74688796680498 | J18: =LOG10(RC[-1]) -> 1.3169529617611504 | K18: =1.75*RC[-1] -> 2.3046676830820134 | L18: =11*LOG10(RC[-2]) -> 1.3152728966856806
A19: 3 | B19: 1 | C19: LINQ | D19: linq | E19: /development/software-development/net/linq | F19: =2.5*LOG10(RC[-4]+2) -> 1.1928031367991561 | G19: =ABS(RC[-5])/MAX(C[-5]) -> 2.0746887966804979E-3 | H19: =7*RC[-1] -> 1.4522821576763486E-2 | I19: =10000*RC[-2] -> 20.74688796680498 | J19: =LOG10(RC[-1]) -> 1.3169529617611504 | K19: =1.75*RC[-1] -> 2.3046676830820134 | L19: =11*LOG10(RC[-2]) -> 1.3152728966856806
A20: 3 | B20: 1 | C20: LLBLGen | D20: llblgen | E20: /development/software-development/net/llblgen | F20: =2.5*LOG10(RC[-4]+2) -> 1.1928031367991561 | G20: =ABS(RC[-5])/MAX(C[-5]) -> 2.0746887966804979E-3 | H20: =7*RC[-1] -> 1.4522821576763486E-2 | I20: =10000*RC[-2] -> 20.74688796680498 | J20: =LOG10(RC[-1]) -> 1.3169529617611504 | K20: =1.75*RC[-1] -> 2.3046676830820134 | L20: =11*LOG10(RC[-2]) -> 1.3152728966856806
A21: 3 | B21: 1 | C21: MEF | D21: mef | E21: /development/software-development/net/mef | F21: =2.5*LOG10(RC[-4]+2) -> 1.1928031367991561 | G21: =ABS(RC[-5])/MAX(C[-5]) -> 2.0746887966804979E-3 | H21: =7*RC[-1] -> 1.4522821576763486E-2 | I21: =10000*RC[-2] -> 20.74688796680498 | J21: =LOG10(RC[-1]) -> 1.3169529617611504 | K21: =1.75*RC[-1] -> 2.3046676830820134 | L21: =11*LOG10(RC[-2]) -> 1.3152728966856806
A22: 3 | B22: 1 | C22: Microsoft Surface | D22: microsoft-surface | E22: /development/software-development/net/microsoft-surface | F22: =2.5*LOG10(RC[-4]+2) -> 1.1928031367991561 | G22: =ABS(RC[-5])/MAX(C[-5]) -> 2.0746887966804979E-3 | H22: =7*RC[-1] -> 1.4522821576763486E-2 | I22: =10000*RC[-2] -> 20.74688796680498 | J22: =LOG10(RC[-1]) -> 1.3169529617611504 | K22: =1.75*RC[-1] -> 2.3046676830820134 | L22: =11*LOG10(RC[-2]) -> 1.3152728966856806
A23: 3 | B23: 1 | C23: RESX | D23: resx | E23: /development/software-development/net/resx | F23: =2.5*LOG10(RC[-4]+2) -> 1.1928031367991561 | G23: =ABS(RC[-5])/MAX(C[-5]) -> 2.0746887966804979E-3 | H23: =7*RC[-1] -> 1.4522821576763486E-2 | I23: =10000*RC[-2] -> 20.74688796680498 | J23: =LOG10(RC[-1]) -> 1.3169529617611504 | K23: =1.75*RC[-1] -> 2.3046676830820134 | L23: =11*LOG10(RC[-2]) -> 1.3152728966856806
A24: 3 | B24: 1 | C24: SilverLight | D24: silverlight | E24: /development/software-development/net/silverlight | F24: =2.5*LOG10(RC[-4]+2) -> 1.1928031367991561 | G24: =ABS(RC[-5])/MAX(C[-5]) -> 2.0746887966804979E-3 | H24: =7*RC[-1] -> 1.4522821576763486E-2 | I24: =10000*RC[-2] -> 20.74688796680498 | J24: =LOG10(RC[-1]) -> 1.3169529617611504 | K24: =1.75*RC[-1] -> 2.3046676830820134 | L24: =11*LOG10(RC[-2]) -> 1.3152728966856806
A25: 3 | B25: 1 | C25: XAML | D25: xaml | E25: /development/software-development/net/xaml | F25: =2.5*LOG10(RC[-4]+2) -> 1.1928031367991561 | G25: =ABS(RC[-5])/MAX(C[-5]) -> 2.0746887966804979E-3 | H25: =7*RC[-1] -> 1.4522821576763486E-2 | I25: =10000*RC[-2] -> 20.74688796680498 | J25: =LOG10(RC[-1]) -> 1.3169529617611504 | K25: =1.75*RC[-1] -> 2.3046676830820134 | L25: =11*LOG10(RC[-2]) -> 1.3152728966856806
A26: 3 | B26: 1 | C26: XNA | D26: xna | E26: /development/software-development/net/xna | F26: =2.5*LOG10(RC[-4]+2) -> 1.1928031367991561 | G26: =ABS(RC[-5])/MAX(C[-5]) -> 2.0746887966804979E-3 | H26: =7*RC[-1] -> 1.4522821576763486E-2 | I26: =10000*RC[-2] -> 20.74688796680498 | J26: =LOG10(RC[-1]) -> 1.3169529617611504 | K26: =1.75*RC[-1] -> 2.3046676830820134 | L26: =11*LOG10(RC[-2]) -> 1.3152728966856806
A27: 3 | B27: 1 | C27: Unit Testing | D27: unit-testing | E27: /development/software-development/agile/unit-testing | F27: =2.5*LOG10(RC[-4]+2) -> 1.1928031367991561 | G27: =ABS(RC[-5])/MAX(C[-5]) -> 2.0746887966804979E-3 | H27: =7*RC[-1] -> 1.4522821576763486E-2 | I27: =10000*RC[-2] -> 20.74688796680498 | J27: =LOG10(RC[-1]) -> 1.3169529617611504 | K27: =1.75*RC[-1] -> 2.3046676830820134 | L27: =11*LOG10(RC[-2]) -> 1.3152728966856806
A28: 2 | B28: 1 | C28: COBOL | D28: cobol | E28: /development/software-development/cobol | F28: =2.5*LOG10(RC[-4]+2) -> 1.1928031367991561 | G28: =ABS(RC[-5])/MAX(C[-5]) -> 2.0746887966804979E-3 | H28: =7*RC[-1] -> 1.4522821576763486E-2 | I28: =10000*RC[-2] -> 20.74688796680498 | J28: =LOG10(RC[-1]) -> 1.3169529617611504 | K28: =1.75*RC[-1] -> 2.3046676830820134 | L28: =11*LOG10(RC[-2]) -> 1.3152728966856806
A29: 2 | B29: 1 | C29: CSV | D29: csv | E29: /development/software-development/csv | F29: =2.5*LOG10(RC[-4]+2) -> 1.1928031367991561 | G29: =ABS(RC[-5])/MAX(C[-5]) -> 2.0746887966804979E-3 | H29: =7*RC[-1] -> 1.4522821576763486E-2 | I29: =10000*RC[-2] -> 20.74688796680498 | J29: =LOG10(RC[-1]) -> 1.3169529617611504 | K29: =1.75*RC[-1] -> 2.3046676830820134 | L29: =11*LOG10(RC[-2]) -> 1.3152728966856806
A30: 3 | B30: 1 | C30: Remote Debugging | D30: remote-debugging | E30: /development/software-development/debugging/remote-debugging | F30: =2.5*LOG10(RC[-4]+2) -> 1.1928031367991561 | G30: =ABS(RC[-5])/MAX(C[-5]) -> 2.0746887966804979E-3 | H30: =7*RC[-1] -> 1.4522821576763486E-2 | I30: =10000*RC[-2] -> 20.74688796680498 | J30: =LOG10(RC[-1]) -> 1.3169529617611504 | K30: =1.75*RC[-1] -> 2.3046676830820134 | L30: =11*LOG10(RC[-2]) -> 1.3152728966856806
A31: 3 | B31: 1 | C31: DUnit | D31: dunit | E31: /development/software-development/delphi/dunit | F31: =2.5*LOG10(RC[-4]+2) -> 1.1928031367991561 | G31: =ABS(RC[-5])/MAX(C[-5]) -> 2.0746887966804979E-3 | H31: =7*RC[-1] -> 1.4522821576763486E-2 | I31: =10000*RC[-2] -> 20.74688796680498 | J31: =LOG10(RC[-1]) -> 1.3169529617611504 | K31: =1.75*RC[-1] -> 2.3046676830820134 | L31: =11*LOG10(RC[-2]) -> 1.3152728966856806
A32: 4 | B32: 1 | C32: OS X FMX | D32: os-x-fmx | E32: /development/software-development/delphi/firemonkey/os-x-fmx | F32: =2.5*LOG10(RC[-4]+2) -> 1.1928031367991561 | G32: =ABS(RC[-5])/MAX(C[-5]) -> 2.0746887966804979E-3 | H32: =7*RC[-1] -> 1.4522821576763486E-2 | I32: =10000*RC[-2] -> 20.74688796680498 | J32: =LOG10(RC[-1]) -> 1.3169529617611504 | K32: =1.75*RC[-1] -> 2.3046676830820134 | L32: =11*LOG10(RC[-2]) -> 1.3152728966856806
A33: 3 | B33: 1 | C33: Ansi | D33: ansi | E33: /development/software-development/encoding/ansi | F33: =2.5*LOG10(RC[-4]+2) -> 1.1928031367991561 | G33: =ABS(RC[-5])/MAX(C[-5]) -> 2.0746887966804979E-3 | H33: =7*RC[-1] -> 1.4522821576763486E-2 | I33: =10000*RC[-2] -> 20.74688796680498 | J33: =LOG10(RC[-1]) -> 1.3169529617611504 | K33: =1.75*RC[-1] -> 2.3046676830820134 | L33: =11*LOG10(RC[-2]) -> 1.3152728966856806
A34: 2 | B34: 1 | C34: iSeries | D34: iseries | E34: /development/software-development/iseries | F34: =2.5*LOG10(RC[-4]+2) -> 1.1928031367991561 | G34: =ABS(RC[-5])/MAX(C[-5]) -> 2.0746887966804979E-3 | H34: =7*RC[-1] -> 1.4522821576763486E-2 | I34: =10000*RC[-2] -> 20.74688796680498 | J34: =LOG10(RC[-1]) -> 1.3169529617611504 | K34: =1.75*RC[-1] -> 2.3046676830820134 | L34: =11*LOG10(RC[-2]) -> 1.3152728966856806
A35: 3 | B35: 1 | C35: JavaScript/ECMAScript | D35: javascript-ecmascript | E35: /development/software-development/scripting/javascript-ecmascript | F35: =2.5*LOG10(RC[-4]+2) -> 1.1928031367991561 | G35: =ABS(RC[-5])/MAX(C[-5]) -> 2.0746887966804979E-3 | H35: =7*RC[-1] -> 1.4522821576763486E-2 | I35: =10000*RC[-2] -> 20.74688796680498 | J35: =LOG10(RC[-1]) -> 1.3169529617611504 | K35: =1.75*RC[-1] -> 2.3046676830820134 | L35: =11*LOG10(RC[-2]) -> 1.3152728966856806
A36: 3 | B36: 1 | C36: Fiddler | D36: fiddler | E36: /development/software-development/web-development/fiddler | F36: =2.5*LOG10(RC[-4]+2) -> 1.1928031367991561 | G36: =ABS(RC[-5])/MAX(C[-5]) -> 2.0746887966804979E-3 | H36: =7*RC[-1] -> 1.4522821576763486E-2 | I36: =10000*RC[-2] -> 20.74688796680498 | J36: =LOG10(RC[-1]) -> 1.3169529617611504 | K36: =1.75*RC[-1] -> 2.3046676830820134 | L36: =11*LOG10(RC[-2]) -> 1.3152728966856806
A37: 3 | B37: 1 | C37: SharePoint | D37: sharepoint | E37: /development/software-development/web-development/sharepoint | F37: =2.5*LOG10(RC[-4]+2) -> 1.1928031367991561 | G37: =ABS(RC[-5])/MAX(C[-5]) -> 2.0746887966804979E-3 | H37: =7*RC[-1] -> 1.4522821576763486E-2 | I37: =10000*RC[-2] -> 20.74688796680498 | J37: =LOG10(RC[-1]) -> 1.3169529617611504 | K37: =1.75*RC[-1] -> 2.3046676830820134 | L37: =11*LOG10(RC[-2]) -> 1.3152728966856806
A38: 2 | B38: 1 | C38: Dimensions CM by Serena | D38: dimensions-cm-by-serena | E38: /development/source-code-management/dimensions-cm-by-serena | F38: =2.5*LOG10(RC[-4]+2) -> 1.1928031367991561 | G38: =ABS(RC[-5])/MAX(C[-5]) -> 2.0746887966804979E-3 | H38: =7*RC[-1] -> 1.4522821576763486E-2 | I38: =10000*RC[-2] -> 20.74688796680498 | J38: =LOG10(RC[-1]) -> 1.3169529617611504 | K38: =1.75*RC[-1] -> 2.3046676830820134 | L38: =11*LOG10(RC[-2]) -> 1.3152728966856806
A39: 1 | B39: 1 | C39: Vista | D39: vista | E39: /development/vista | F39: =2.5*LOG10(RC[-4]+2) -> 1.1928031367991561 | G39: =ABS(RC[-5])/MAX(C[-5]) -> 2.0746887966804979E-3 | H39: =7*RC[-1] -> 1.4522821576763486E-2 | I39: =10000*RC[-2] -> 20.74688796680498 | J39: =LOG10(RC[-1]) -> 1.3169529617611504 | K39: =1.75*RC[-1] -> 2.3046676830820134 | L39: =11*LOG10(RC[-2]) -> 1.3152728966856806
A40: 1 | B40: 1 | C40: Briefing | D40: briefing | E40: /event/briefing | F40: =2.5*LOG10(RC[-4]+2) -> 1.1928031367991561 | G40: =ABS(RC[-5])/MAX(C[-5]) -> 2.0746887966804979E-3 | H40: =7*RC[-1] -> 1.4522821576763486E-2 | I40: =10000*RC[-2] -> 20.74688796680498 | J40: =LOG10(RC[-1]) -> 1.3169529617611504 | K40: =1.75*RC[-1] -> 2.3046676830820134 | L40: =11*LOG10(RC[-2]) -> 1.3152728966856806
A41: 2 | B41: 1 | C41: Delphi-Tage.de | D41: delphi-tage-de | E41: /event/conferences/delphi-tage-de | F41: =2.5*LOG10(RC[-4]+2) -> 1.1928031367991561 | G41: =ABS(RC[-5])/MAX(C[-5]) -> 2.0746887966804979E-3 | H41: =7*RC[-1] -> 1.4522821576763486E-2 | I41: =10000*RC[-2] -> 20.74688796680498 | J41: =LOG10(RC[-1]) -> 1.3169529617611504 | K41: =1.75*RC[-1] -> 2.3046676830820134 | L41: =11*LOG10(RC[-2]) -> 1.3152728966856806
A42: 1 | B42: 1 | C42: Seminar | D42: seminar | E42: /event/seminar | F42: =2.5*LOG10(RC[-4]+2) -> 1.1928031367991561 | G42: =ABS(RC[-5])/MAX(C[-5]) -> 2.0746887966804979E-3 | H42: =7*RC[-1] -> 1.4522821576763486E-2 | I42: =10000*RC[-2] -> 20.74688796680498 | J42: =LOG10(RC[-1]) -> 1.3169529617611504 | K42: =1.75*RC[-1] -> 2.3046676830820134 | L42: =11*LOG10(RC[-2]) -> 1.3152728966856806
A43: 0 | B43: 1 | C43: Infratructure | D43: infratructure | E43: /infratructure | F43: =2.5*LOG10(RC[-4]+2) -> 1.1928031367991561 | G43: =ABS(RC[-5])/MAX(C[-5]) -> 2.0746887966804979E-3 | H43: =7*RC[-1] -> 1.4522821576763486E-2 | I43: =10000*RC[-2] -> 20.74688796680498 | J43: =LOG10(RC[-1]) -> 1.3169529617611504 | K43: =1.75*RC[-1] -> 2.3046676830820134 | L43: =11*LOG10(RC[-2]) -> 1.3152728966856806
A44: 1 | B44: 1 | C44: Firewall | D44: firewall | E44: /infratructure/firewall | F44: =2.5*LOG10(RC[-4]+2) -> 1.1928031367991561 | G44: =ABS(RC[-5])/MAX(C[-5]) -> 2.0746887966804979E-3 | H44: =7*RC[-1] -> 1.4522821576763486E-2 | I44: =10000*RC[-2] -> 20.74688796680498 | J44: =LOG10(RC[-1]) -> 1.3169529617611504 | K44: =1.75*RC[-1] -> 2.3046676830820134 | L44: =11*LOG10(RC[-2]) -> 1.3152728966856806
A45: 2 | B45: 1 | C45: Endian | D45: endian | E45: /infratructure/firewall/endian | F45: =2.5*LOG10(RC[-4]+2) -> 1.1928031367991561 | G45: =ABS(RC[-5])/MAX(C[-5]) -> 2.0746887966804979E-3 | H45: =7*RC[-1] -> 1.4522821576763486E-2 | I45: =10000*RC[-2] -> 20.74688796680498 | J45: =LOG10(RC[-1]) -> 1.3169529617611504 | K45: =1.75*RC[-1] -> 2.3046676830820134 | L45: =11*LOG10(RC[-2]) -> 1.3152728966856806
A46: 2 | B46: 1 | C46: Cygwin | D46: cygwin | E46: /power-user/nix/cygwin | F46: =2.5*LOG10(RC[-4]+2) -> 1.1928031367991561 | G46: =ABS(RC[-5])/MAX(C[-5]) -> 2.0746887966804979E-3 | H46: =7*RC[-1] -> 1.4522821576763486E-2 | I46: =10000*RC[-2] -> 20.74688796680498 | J46: =LOG10(RC[-1]) -> 1.3169529617611504 | K46: =1.75*RC[-1] -> 2.3046676830820134 | L46: =11*LOG10(RC[-2]) -> 1.3152728966856806
A47: 1 | B47: 1 | C47: Adobe | D47: adobe | E47: /power-user/adobe | F47: =2.5*LOG10(RC[-4]+2) -> 1.1928031367991561 | G47: =ABS(RC[-5])/MAX(C[-5]) -> 2.0746887966804979E-3 | H47: =7*RC[-1] -> 1.4522821576763486E-2 | I47: =10000*RC[-2] -> 20.74688796680498 | J47: =LOG10(RC[-1]) -> 1.3169529617611504 | K47: =1.75*RC[-1] -> 2.3046676830820134 | L47: =11*LOG10(RC[-2]) -> 1.3152728966856806
A48: 1 | B48: 1 | C48: Clipboard | D48: clipboard | E48: /power-user/clipboard | F48: =2.5*LOG10(RC[-4]+2) -> 1.1928031367991561 | G48: =ABS(RC[-5])/MAX(C[-5]) -> 2.0746887966804979E-3 | H48: =7*RC[-1] -> 1.4522821576763486E-2 | I48: =10000*RC[-2] -> 20.74688796680498 | J48: =LOG10(RC[-1]) -> 1.3169529617611504 | K48: =1.75*RC[-1] -> 2.3046676830820134 | L48: =11*LOG10(RC[-2]) -> 1.3152728966856806
A49: 1 | B49: 1 | C49: DIY | D49: diy | E49: /power-user/diy | F49: =2.5*LOG10(RC[-4]+2) -> 1.1928031367991561 | G49: =ABS(RC[-5])/MAX(C[-5]) -> 2.0746887966804979E-3 | H49: =7*RC[-1] -> 1.4522821576763486E-2 | I49: =10000*RC[-2] -> 20.74688796680498 | J49: =LOG10(RC[-1]) -> 1.3169529617611504 | K49: =1.75*RC[-1] -> 2.3046676830820134 | L49: =11*LOG10(RC[-2]) -> 1.3152728966856806
A50: 1 | B50: 1 | C50: Emulators | D50: emulators | E50: /power-user/emulators | F50: =2.5*LOG10(RC[-4]+2) -> 1.1928031367991561 | G50: =ABS(RC[-5])/MAX(C[-5]) -> 2.0746887966804979E-3 | H50: =7*RC[-1] -> 1.4522821576763486E-2 | I50: =10000*RC[-2] -> 20.74688796680498 | J50: =LOG10(RC[-1]) -> 1.3169529617611504 | K50: =1.75*RC[-1] -> 2.3046676830820134 | L50: =11*LOG10(RC[-2]) -> 1.3152728966856806
A51: 1 | B51: 1 | C51: Gadget | D51: gadget | E51: /power-user/gadget | F51: =2.5*LOG10(RC[-4]+2) -> 1.1928031367991561 | G51: =ABS(RC[-5])/MAX(C[-5]) -> 2.0746887966804979E-3 | H51: =7*RC[-1] -> 1.4522821576763486E-2 | I51: =10000*RC[-2] -> 20.74688796680498 | J51: =LOG10(RC[-1]) -> 1.3169529617611504 | K51: =1.75*RC[-1] -> 2.3046676830820134 | L51: =11*LOG10(RC[-2]) -> 1.3152728966856806
A52: 1 | B52: 1 | C52: GodMode | D52: godmode | E52: /power-user/godmode | F52: =2.5*LOG10(RC[-4]+2) -> 1.1928031367991561 | G52: =ABS(RC[-5])/MAX(C[-5]) -> 2.0746887966804979E-3 | H52: =7*RC[-1] -> 1.4522821576763486E-2 | I52: =10000*RC[-2] -> 20.74688796680498 | J52: =LOG10(RC[-1]) -> 1.3169529617611504 | K52: =1.75*RC[-1] -> 2.3046676830820134 | L52: =11*LOG10(RC[-2]) -> 1.3152728966856806
A53: 2 | B53: 1 | C53: Chrome | D53: chrome | E53: /power-user/google/chrome | F53: =2.5*LOG10(RC[-4]+2) -> 1.1928031367991561 | G53: =ABS(RC[-5])/MAX(C[-5]) -> 2.0746887966804979E-3 | H53: =7*RC[-1] -> 1.4522821576763486E-2 | I53: =10000*RC[-2] -> 20.74688796680498 | J53: =LOG10(RC[-1]) -> 1.3169529617611504 | K53: =1.75*RC[-1] -> 2.3046676830820134 | L53: =11*LOG10(RC[-2]) -> 1.3152728966856806
A54: 2 | B54: 1 | C54: GoogleCalendar | D54: googlecalendar | E54: /power-user/google/googlecalendar | F54: =2.5*LOG10(RC[-4]+2) -> 1.1928031367991561 | G54: =ABS(RC[-5])/MAX(C[-5]) -> 2.0746887966804979E-3 | H54: =7*RC[-1] -> 1.4522821576763486E-2 | I54: =10000*RC[-2] -> 20.74688796680498 | J54: =LOG10(RC[-1]) -> 1.3169529617611504 | K54: =1.75*RC[-1] -> 2.3046676830820134 | L54: =11*LOG10(RC[-2]) -> 1.3152728966856806
A55: 2 | B55: 1 | C55: GoogleMaps | D55: googlemaps | E55: /power-user/google/googlemaps | F55: =2.5*LOG10(RC[-4]+2) -> 1.1928031367991561 | G55: =ABS(RC[-5])/MAX(C[-5]) -> 2.0746887966804979E-3 | H55: =7*RC[-1] -> 1.4522821576763486E-2 | I55: =10000*RC[-2] -> 20.74688796680498 | J55: =LOG10(RC[-1]) -> 1.3169529617611504 | K55: =1.75*RC[-1] -> 2.3046676830820134 | L55: =11*LOG10(RC[-2]) -> 1.3152728966856806
A56: 1 | B56: 1 | C56: LinkedIn | D56: linkedin | E56: /power-user/linkedin | F56: =2.5*LOG10(RC[-4]+2) -> 1.1928031367991561 | G56: =ABS(RC[-5])/MAX(C[-5]) -> 2.0746887966804979E-3 | H56: =7*RC[-1] -> 1.4522821576763486E-2 | I56: =10000*RC[-2] -> 20.74688796680498 | J56: =LOG10(RC[-1]) -> 1.3169529617611504 | K56: =1.75*RC[-1] -> 2.3046676830820134 | L56: =11*LOG10(RC[-2]) -> 1.3152728966856806
A57: 1 | B57: 1 | C57: Media Streaming | D57: media-streaming | E57: /power-user/media-streaming | F57: =2.5*LOG10(RC[-4]+2) -> 1.1928031367991561 | G57: =ABS(RC[-5])/MAX(C[-5]) -> 2.0746887966804979E-3 | H57: =7*RC[-1] -> 1.4522821576763486E-2 | I57: =10000*RC[-2] -> 20.74688796680498 | J57: =LOG10(RC[-1]) -> 1.3169529617611504 | K57: =1.75*RC[-1] -> 2.3046676830820134 | L57: =11*LOG10(RC[-2]) -> 1.3152728966856806
A58: 1 | B58: 1 | C58: Office | D58: office | E58: /power-user/office | F58: =2.5*LOG10(RC[-4]+2) -> 1.1928031367991561 | G58: =ABS(RC[-5])/MAX(C[-5]) -> 2.0746887966804979E-3 | H58: =7*RC[-1] -> 1.4522821576763486E-2 | I58: =10000*RC[-2] -> 20.74688796680498 | J58: =LOG10(RC[-1]) -> 1.3169529617611504 | K58: =1.75*RC[-1] -> 2.3046676830820134 | L58: =11*LOG10(RC[-2]) -> 1.3152728966856806
A59: 2 | B59: 1 | C59: Word | D59: word | E59: /power-user/office/word | F59: =2.5*LOG10(RC[-4]+2) -> 1.1928031367991561 | G59: =ABS(RC[-5])/MAX(C[-5]) -> 2.0746887966804979E-3 | H59: =7*RC[-1] -> 1.4522821576763486E-2 | I59: =10000*RC[-2] -> 20.74688796680498 | J59: =LOG10(RC[-1]) -> 1.3169529617611504 | K59: =1.75*RC[-1] -> 2.3046676830820134 | L59: =11*LOG10(RC[-2]) -> 1.3152728966856806
A60: 1 | B60: 1 | C60: OpenVPN | D60: openvpn | E60: /power-user/openvpn | F60: =2.5*LOG10(RC[-4]+2) -> 1.1928031367991561 | G60: =ABS(RC[-5])/MAX(C[-5]) -> 2.0746887966804979E-3 | H60: =7*RC[-1] -> 1.4522821576763486E-2 | I60: =10000*RC[-2] -> 20.74688796680498 | J60: =LOG10(RC[-1]) -> 1.3169529617611504 | K60: =1.75*RC[-1] -> 2.3046676830820134 | L60: =11*LOG10(RC[-2]) -> 1.3152728966856806
A61: 1 | B61: 1 | C61: PDF | D61: pdf | E61: /power-user/pdf | F61: =2.5*LOG10(RC[-4]+2) -> 1.1928031367991561 | G61: =ABS(RC[-5])/MAX(C[-5]) -> 2.0746887966804979E-3 | H61: =7*RC[-1] -> 1.4522821576763486E-2 | I61: =10000*RC[-2] -> 20.74688796680498 | J61: =LOG10(RC[-1]) -> 1.3169529617611504 | K61: =1.75*RC[-1] -> 2.3046676830820134 | L61: =11*LOG10(RC[-2]) -> 1.3152728966856806
A62: 1 | B62: 1 | C62: Photography | D62: photography | E62: /power-user/photography | F62: =2.5*LOG10(RC[-4]+2) -> 1.1928031367991561 | G62: =ABS(RC[-5])/MAX(C[-5]) -> 2.0746887966804979E-3 | H62: =7*RC[-1] -> 1.4522821576763486E-2 | I62: =10000*RC[-2] -> 20.74688796680498 | J62: =LOG10(RC[-1]) -> 1.3169529617611504 | K62: =1.75*RC[-1] -> 2.3046676830820134 | L62: =11*LOG10(RC[-2]) -> 1.3152728966856806
A63: 1 | B63: 1 | C63: Security | D63: security | E63: /power-user/security | F63: =2.5*LOG10(RC[-4]+2) -> 1.1928031367991561 | G63: =ABS(RC[-5])/MAX(C[-5]) -> 2.0746887966804979E-3 | H63: =7*RC[-1] -> 1.4522821576763486E-2 | I63: =10000*RC[-2] -> 20.74688796680498 | J63: =LOG10(RC[-1]) -> 1.3169529617611504 | K63: =1.75*RC[-1] -> 2.3046676830820134 | L63: =11*LOG10(RC[-2]) -> 1.3152728966856806
A64: 2 | B64: 1 | C64: FireFox | D64: firefox | E64: /power-user/web-browsers/firefox | F64: =2.5*LOG10(RC[-4]+2) -> 1.1928031367991561 | G64: =ABS(RC[-5])/MAX(C[-5]) -> 2.0746887966804979E-3 | H64: =7*RC[-1] -> 1.4522821576763486E-2 | I64: =10000*RC[-2] -> 20.74688796680498 | J64: =LOG10(RC[-1]) -> 1.3169529617611504 | K64: =1.75*RC[-1] -> 2.3046676830820134 | L64: =11*LOG10(RC[-2]) -> 1.3152728966856806
A65: 2 | B65: 1 | C65: Internet Explorer | D65: internet-explorer | E65: /power-user/web-browsers/internet-explorer | F65: =2.5*LOG10(RC[-4]+2) -> 1.1928031367991561 | G65: =ABS(RC[-5])/MAX(C[-5]) -> 2.0746887966804979E-3 | H65: =7*RC[-1] -> 1.4522821576763486E-2 | I65: =10000*RC[-2] -> 20.74688796680498 | J65: =LOG10(RC[-1]) -> 1.3169529617611504 | K65: =1.75*RC[-1] -> 2.3046676830820134 | L65: =11*LOG10(RC[-2]) -> 1.3152728966856806
A66: 3 | B66: 1 | C66: Microsoft Surface on Windows 7 | D66: microsoft-surface-on-windows-7 | E66: /power-user/windows/windows-7/microsoft-surface-on-windows-7 | F66: =2.5*LOG10(RC[-4]+2) -> 1.1928031367991561 | G66: =ABS(RC[-5])/MAX(C[-5]) -> 2.0746887966804979E-3 | H66: =7*RC[-1] -> 1.4522821576763486E-2 | I66: =10000*RC[-2] -> 20.74688796680498 | J66: =LOG10(RC[-1]) -> 1.3169529617611504 | K66: =1.75*RC[-1] -> 2.3046676830820134 | L66: =11*LOG10(RC[-2]) -> 1.3152728966856806
A67: 0 | B67: 1 | C67: Schiphol | D67: schiphol | E67: /schiphol | F67: =2.5*LOG10(RC[-4]+2) -> 1.1928031367991561 | G67: =ABS(RC[-5])/MAX(C[-5]) -> 2.0746887966804979E-3 | H67: =7*RC[-1] -> 1.4522821576763486E-2 | I67: =10000*RC[-2] -> 20.74688796680498 | J67: =LOG10(RC[-1]) -> 1.3169529617611504 | K67: =1.75*RC[-1] -> 2.3046676830820134 | L67: =11*LOG10(RC[-2]) -> 1.3152728966856806
A68: 1 | B68: 1 | C68: G+: GooglePlus | D68: g---googleplus | E68: /socialmedia/g---googleplus | F68: =2.5*LOG10(RC[-4]+2) -> 1.1928031367991561 | G68: =ABS(RC[-5])/MAX(C[-5]) -> 2.0746887966804979E-3 | H68: =7*RC[-1] -> 1.4522821576763486E-2 | I68: =10000*RC[-2] -> 20.74688796680498 | J68: =LOG10(RC[-1]) -> 1.3169529617611504 | K68: =1.75*RC[-1] -> 2.3046676830820134 | L68: =11*LOG10(RC[-2]) -> 1.3152728966856806
A69: 1 | B69: 1 | C69: LinkedIn | D69: linkedin | E69: /socialmedia/linkedin | F69: =2.5*LOG10(RC[-4]+2) -> 1.1928031367991561 | G69: =ABS(RC[-5])/MAX(C[-5]) -> 2.0746887966804979E-3 | H69: =7*RC[-1] -> 1.4522821576763486E-2 | I69: =10000*RC[-2] -> 20.74688796680498 | J69: =LOG10(RC[-1]) -> 1.3169529617611504 | K69: =1.75*RC[-1] -> 2.3046676830820134 | L69: =11*LOG10(RC[-2]) -> 1.3152728966856806
A70: 2 | B70: 2 | C70: Certifications | D70: certifications | E70: /about/personal/certifications | F70: =2.5*LOG10(RC[-4]+2) -> 1.505149978319906 | G70: =ABS(RC[-5])/MAX(C[-5]) -> 4.1493775933609959E-3 | H70: =7*RC[-1] -> 2.9045643153526972E-2 | I70: =10000*RC[-2] -> 41.49377593360996 | J70: =LOG10(RC[-1]) -> 1.6179829574251317 | K70: =1.75*RC[-1] -> 2.8314701754939806 | L70: =11*LOG10(RC[-2]) -> 2.2987133705781968
A71: 3 | B71: 2 | C71: SQL Server 2008 | D71: sql-server-2008 | E71: /development/database-development/sql-server/sql-server-2008 | F71: =2.5*LOG10(RC[-4]+2) -> 1.505149978319906 | G71: =ABS(RC[-5])/MAX(C[-5]) -> 4.1493775933609959E-3 | H71: =7*RC[-1] -> 2.9045643153526972E-2 | I71: =10000*RC[-2] -> 41.49377593360996 | J71: =LOG10(RC[-1]) -> 1.6179829574251317 | K71: =1.75*RC[-1] -> 2.8314701754939806 | L71: =11*LOG10(RC[-2]) -> 2.2987133705781968
A72: 4 | B72: 2 | C72: C# 5.0 | D72: c--5-0 | E72: /development/software-development/net/c-/c--5-0 | F72: =2.5*LOG10(RC[-4]+2) -> 1.505149978319906 | G72: =ABS(RC[-5])/MAX(C[-5]) -> 4.1493775933609959E-3 | H72: =7*RC[-1] -> 2.9045643153526972E-2 | I72: =10000*RC[-2] -> 41.49377593360996 | J72: =LOG10(RC[-1]) -> 1.6179829574251317 | K72: =1.75*RC[-1] -> 2.8314701754939806 | L72: =11*LOG10(RC[-2]) -> 2.2987133705781968
A73: 3 | B73: 2 | C73: Mono for Android | D73: mono-for-android | E73: /development/software-development/net/mono-for-android | F73: =2.5*LOG10(RC[-4]+2) -> 1.505149978319906 | G73: =ABS(RC[-5])/MAX(C[-5]) -> 4.1493775933609959E-3 | H73: =7*RC[-1] -> 2.9045643153526972E-2 | I73: =10000*RC[-2] -> 41.49377593360996 | J73: =LOG10(RC[-1]) -> 1.6179829574251317 | K73: =1.75*RC[-1] -> 2.8314701754939806 | L73: =11*LOG10(RC[-2]) -> 2.2987133705781968
A74: 4 | B74: 2 | C74: Visual Studio 11 | D74: visual-studio-11 | E74: /development/software-development/net/visual-studio-and-tools/visual-studio-11 | F74: =2.5*LOG10(RC[-4]+2) -> 1.505149978319906 | G74: =ABS(RC[-5])/MAX(C[-5]) -> 4.1493775933609959E-3 | H74: =7*RC[-1] -> 2.9045643153526972E-2 | I74: =10000*RC[-2] -> 41.49377593360996 | J74: =LOG10(RC[-1]) -> 1.6179829574251317 | K74: =1.75*RC[-1] -> 2.8314701754939806 | L74: =11*LOG10(RC[-2]) -> 2.2987133705781968
A75: 2 | B75: 2 | C75: BASS | D75: bass | E75: /development/software-development/bass | F75: =2.5*LOG10(RC[-4]+2) -> 1.505149978319906 | G75: =ABS(RC[-5])/MAX(C[-5]) -> 4.1493775933609959E-3 | H75: =7*RC[-1] -> 2.9045643153526972E-2 | I75: =10000*RC[-2] -> 41.49377593360996 | J75: =LOG10(RC[-1]) -> 1.6179829574251317 | K75: =1.75*RC[-1] -> 2.8314701754939806 | L75: =11*LOG10(RC[-2]) -> 2.2987133705781968
A76: 2 | B76: 2 | C76: Cloud Development | D76: cloud-development | E76: /development/software-development/cloud-development | F76: =2.5*LOG10(RC[-4]+2) -> 1.505149978319906 | G76: =ABS(RC[-5])/MAX(C[-5]) -> 4.1493775933609959E-3 | H76: =7*RC[-1] -> 2.9045643153526972E-2 | I76: =10000*RC[-2] -> 41.49377593360996 | J76: =LOG10(RC[-1]) -> 1.6179829574251317 | K76: =1.75*RC[-1] -> 2.8314701754939806 | L76: =11*LOG10(RC[-2]) -> 2.2987133705781968
A77: 3 | B77: 2 | C77: Windows Azure | D77: windows-azure | E77: /development/software-development/cloud-development/windows-azure | F77: =2.5*LOG10(RC[-4]+2) -> 1.505149978319906 | G77: =ABS(RC[-5])/MAX(C[-5]) -> 4.1493775933609959E-3 | H77: =7*RC[-1] -> 2.9045643153526972E-2 | I77: =10000*RC[-2] -> 41.49377593360996 | J77: =LOG10(RC[-1]) -> 1.6179829574251317 | K77: =1.75*RC[-1] -> 2.8314701754939806 | L77: =11*LOG10(RC[-2]) -> 2.2987133705781968
A78: 3 | B78: 2 | C78: EBCDIC | D78: ebcdic | E78: /development/software-development/encoding/ebcdic | F78: =2.5*LOG10(RC[-4]+2) -> 1.505149978319906 | G78: =ABS(RC[-5])/MAX(C[-5]) -> 4.1493775933609959E-3 | H78: =7*RC[-1] -> 2.9045643153526972E-2 | I78: =10000*RC[-2] -> 41.49377593360996 | J78: =LOG10(RC[-1]) -> 1.6179829574251317 | K78: =1.75*RC[-1] -> 2.8314701754939806 | L78: =11*LOG10(RC[-2]) -> 2.2987133705781968
A79: 2 | B79: 2 | C79: StUF | D79: stuf | E79: /development/software-development/stuf | F79: =2.5*LOG10(RC[-4]+2) -> 1.505149978319906 | G79: =ABS(RC[-5])/MAX(C[-5]) -> 4.1493775933609959E-3 | H79: =7*RC[-1] -> 2.9045643153526972E-2 | I79: =10000*RC[-2] -> 41.49377593360996 | J79: =LOG10(RC[-1]) -> 1.6179829574251317 | K79: =1.75*RC[-1] -> 2.8314701754939806 | L79: =11*LOG10(RC[-2]) -> 2.2987133705781968
A80: 2 | B80: 2 | C80: Distributed Version Control | D80: distributed-version-control | E80: /development/source-code-management/distributed-version-control | F80: =2.5*LOG10(RC[-4]+2) -> 1.505149978319906 | G80: =ABS(RC[-5])/MAX(C[-5]) -> 4.1493775933609959E-3 | H80: =7*RC[-1] -> 2.9045643153526972E-2 | I80: =10000*RC[-2] -> 41.49377593360996 | J80: =LOG10(RC[-1]) -> 1.6179829574251317 | K80: =1.75*RC[-1] -> 2.8314701754939806 | L80: =11*LOG10(RC[-2]) -> 2.2987133705781968
A81: 2 | B81: 2 | C81: SourceForge | D81: sourceforge | E81: /development/source-code-management/sourceforge | F81: =2.5*LOG10(RC[-4]+2) -> 1.505149978319906 | G81: =ABS(RC[-5])/MAX(C[-5]) -> 4.1493775933609959E-3 | H81: =7*RC[-1] -> 2.9045643153526972E-2 | I81: =10000*RC[-2] -> 41.49377593360996 | J81: =LOG10(RC[-1]) -> 1.6179829574251317 | K81: =1.75*RC[-1] -> 2.8314701754939806 | L81: =11*LOG10(RC[-2]) -> 2.2987133705781968
A82: 2 | B82: 2 | C82: StarTeam | D82: starteam | E82: /development/source-code-management/starteam | F82: =2.5*LOG10(RC[-4]+2) -> 1.505149978319906 | G82: =ABS(RC[-5])/MAX(C[-5]) -> 4.1493775933609959E-3 | H82: =7*RC[-1] -> 2.9045643153526972E-2 | I82: =10000*RC[-2] -> 41.49377593360996 | J82: =LOG10(RC[-1]) -> 1.6179829574251317 | K82: =1.75*RC[-1] -> 2.8314701754939806 | L82: =11*LOG10(RC[-2]) -> 2.2987133705781968
A83: 2 | B83: 2 | C83: DevDays09 | D83: devdays09 | E83: /event/conferences/devdays09 | F83: =2.5*LOG10(RC[-4]+2) -> 1.505149978319906 | G83: =ABS(RC[-5])/MAX(C[-5]) -> 4.1493775933609959E-3 | H83: =7*RC[-1] -> 2.9045643153526972E-2 | I83: =10000*RC[-2] -> 41.49377593360996 | J83: =LOG10(RC[-1]) -> 1.6179829574251317 | K83: =1.75*RC[-1] -> 2.8314701754939806 | L83: =11*LOG10(RC[-2]) -> 2.2987133705781968
A84: 1 | B84: 2 | C84: Truckrun | D84: truckrun | E84: /event/truckrun | F84: =2.5*LOG10(RC[-4]+2) -> 1.505149978319906 | G84: =ABS(RC[-5])/MAX(C[-5]) -> 4.1493775933609959E-3 | H84: =7*RC[-1] -> 2.9045643153526972E-2 | I84: =10000*RC[-2] -> 41.49377593360996 | J84: =LOG10(RC[-1]) -> 1.6179829574251317 | K84: =1.75*RC[-1] -> 2.8314701754939806 | L84: =11*LOG10(RC[-2]) -> 2.2987133705781968
A85: 0 | B85: 2 | C85: Geeky | D85: geeky | E85: /geeky | F85: =2.5*LOG10(RC[-4]+2) -> 1.505149978319906 | G85: =ABS(RC[-5])/MAX(C[-5]) -> 4.1493775933609959E-3 | H85: =7*RC[-1] -> 2.9045643153526972E-2 | I85: =10000*RC[-2] -> 41.49377593360996 | J85: =LOG10(RC[-1]) -> 1.6179829574251317 | K85: =1.75*RC[-1] -> 2.8314701754939806 | L85: =11*LOG10(RC[-2]) -> 2.2987133705781968
A86: 4 | B86: 2 | C86: MacBook-Pro | D86: macbook-pro | E86: /power-user/apple/mac/macbook/macbook-pro | F86: =2.5*LOG10(RC[-4]+2) -> 1.505149978319906 | G86: =ABS(RC[-5])/MAX(C[-5]) -> 4.1493775933609959E-3 | H86: =7*RC[-1] -> 2.9045643153526972E-2 | I86: =10000*RC[-2] -> 41.49377593360996 | J86: =LOG10(RC[-1]) -> 1.6179829574251317 | K86: =1.75*RC[-1] -> 2.8314701754939806 | L86: =11*LOG10(RC[-2]) -> 2.2987133705781968
A87: 1 | B87: 2 | C87: Hardware | D87: hardware | E87: /power-user/hardware | F87: =2.5*LOG10(RC[-4]+2) -> 1.505149978319906 | G87: =ABS(RC[-5])/MAX(C[-5]) -> 4.1493775933609959E-3 | H87: =7*RC[-1] -> 2.9045643153526972E-2 | I87: =10000*RC[-2] -> 41.49377593360996 | J87: =LOG10(RC[-1]) -> 1.6179829574251317 | K87: =1.75*RC[-1] -> 2.8314701754939806 | L87: =11*LOG10(RC[-2]) -> 2.2987133705781968
A88: 2 | B88: 2 | C88: View | D88: view | E88: /power-user/vmware/view | F88: =2.5*LOG10(RC[-4]+2) -> 1.505149978319906 | G88: =ABS(RC[-5])/MAX(C[-5]) -> 4.1493775933609959E-3 | H88: =7*RC[-1] -> 2.9045643153526972E-2 | I88: =10000*RC[-2] -> 41.49377593360996 | J88: =LOG10(RC[-1]) -> 1.6179829574251317 | K88: =1.75*RC[-1] -> 2.8314701754939806 | L88: =11*LOG10(RC[-2]) -> 2.2987133705781968
A89: 1 | B89: 2 | C89: WiFi | D89: wifi | E89: /power-user/wifi | F89: =2.5*LOG10(RC[-4]+2) -> 1.505149978319906 | G89: =ABS(RC[-5])/MAX(C[-5]) -> 4.1493775933609959E-3 | H89: =7*RC[-1] -> 2.9045643153526972E-2 | I89: =10000*RC[-2] -> 41.49377593360996 | J89: =LOG10(RC[-1]) -> 1.6179829574251317 | K89: =1.75*RC[-1] -> 2.8314701754939806 | L89: =11*LOG10(RC[-2]) -> 2.2987133705781968
A90: 2 | B90: 2 | C90: Windows Server 2003 | D90: windows-server-2003 | E90: /power-user/windows/windows-server-2003 | F90: =2.5*LOG10(RC[-4]+2) -> 1.505149978319906 | G90: =ABS(RC[-5])/MAX(C[-5]) -> 4.1493775933609959E-3 | H90: =7*RC[-1] -> 2.9045643153526972E-2 | I90: =10000*RC[-2] -> 41.49377593360996 | J90: =LOG10(RC[-1]) -> 1.6179829574251317 | K90: =1.75*RC[-1] -> 2.8314701754939806 | L90: =11*LOG10(RC[-2]) -> 2.2987133705781968
A91: 2 | B91: 2 | C91: Windows Server 2008 | D91: windows-server-2008 | E91: /power-user/windows/windows-server-2008 | F91: =2.5*LOG10(RC[-4]+2) -> 1.505149978319906 | G91: =ABS(RC[-5])/MAX(C[-5]) -> 4.1493775933609959E-3 | H91: =7*RC[-1] -> 2.9045643153526972E-2 | I91: =10000*RC[-2] -> 41.49377593360996 | J91: =LOG10(RC[-1]) -> 1.6179829574251317 | K91: =1.75*RC[-1] -> 2.8314701754939806 | L91: =11*LOG10(RC[-2]) -> 2.2987133705781968
A92: 0 | B92: 2 | C92: Reference | D92: reference | E92: /reference | F92: =2.5*LOG10(RC[-4]+2) -> 1.505149978319906 | G92: =ABS(RC[-5])/MAX(C[-5]) -> 4.1493775933609959E-3 | H92: =7*RC[-1] -> 2.9045643153526972E-2 | I92: =10000*RC[-2] -> 41.49377593360996 | J92: =LOG10(RC[-1]) -> 1.6179829574251317 | K92: =1.75*RC[-1] -> 2.8314701754939806 | L92: =11*LOG10(RC[-2]) -> 2.2987133705781968
A93: 0 | B93: 3 | C93: Comics | D93: comics | E93: /comics | F93: =2.5*LOG10(RC[-4]+2) -> 1.7474250108400471 | G93: =ABS(RC[-5])/MAX(C[-5]) -> 6.2240663900414933E-3 | H93: =7*RC[-1] -> 4.3568464730290454E-2 | I93: =10000*RC[-2] -> 62.240663900414937 | J93: =LOG10(RC[-1]) -> 1.7940742164808128 | K93: =1.75*RC[-1] -> 3.1396298788414225 | L93: =11*LOG10(RC[-2]) -> 2.7922444526312713
A94: 2 | B94: 3 | C94: USB | D94: usb | E94: /development/hardware-interfacing/usb | F94: =2.5*LOG10(RC[-4]+2) -> 1.7474250108400471 | G94: =ABS(RC[-5])/MAX(C[-5]) -> 6.2240663900414933E-3 | H94: =7*RC[-1] -> 4.3568464730290454E-2 | I94: =10000*RC[-2] -> 62.240663900414937 | J94: =LOG10(RC[-1]) -> 1.7940742164808128 | K94: =1.75*RC[-1] -> 3.1396298788414225 | L94: =11*LOG10(RC[-2]) -> 2.7922444526312713
A95: 1 | B95: 3 | C95: IIS | D95: iis | E95: /development/iis | F95: =2.5*LOG10(RC[-4]+2) -> 1.7474250108400471 | G95: =ABS(RC[-5])/MAX(C[-5]) -> 6.2240663900414933E-3 | H95: =7*RC[-1] -> 4.3568464730290454E-2 | I95: =10000*RC[-2] -> 62.240663900414937 | J95: =LOG10(RC[-1]) -> 1.7940742164808128 | K95: =1.75*RC[-1] -> 3.1396298788414225 | L95: =11*LOG10(RC[-2]) -> 2.7922444526312713
A96: 3 | B96: 3 | C96: WinForms | D96: winforms | E96: /development/software-development/net/winforms | F96: =2.5*LOG10(RC[-4]+2) -> 1.7474250108400471 | G96: =ABS(RC[-5])/MAX(C[-5]) -> 6.2240663900414933E-3 | H96: =7*RC[-1] -> 4.3568464730290454E-2 | I96: =10000*RC[-2] -> 62.240663900414937 | J96: =LOG10(RC[-1]) -> 1.7940742164808128 | K96: =1.75*RC[-1] -> 3.1396298788414225 | L96: =11*LOG10(RC[-2]) -> 2.7922444526312713
A97: 3 | B97: 3 | C97: PowerShell | D97: powershell | E97: /development/software-development/commandline/powershell | F97: =2.5*LOG10(RC[-4]+2) -> 1.7474250108400471 | G97: =ABS(RC[-5])/MAX(C[-5]) -> 6.2240663900414933E-3 | H97: =7*RC[-1] -> 4.3568464730290454E-2 | I97: =10000*RC[-2] -> 62.240663900414937 | J97: =LOG10(RC[-1]) -> 1.7940742164808128 | K97: =1.75*RC[-1] -> 3.1396298788414225 | L97: =11*LOG10(RC[-2]) -> 2.7922444526312713
A98: 3 | B98: 3 | C98: Delphi x64 | D98: delphi-x64 | E98: /development/software-development/delphi/delphi-x64 | F98: =2.5*LOG10(RC[-4]+2) -> 1.7474250108400471 | G98: =ABS(RC[-5])/MAX(C[-5]) -> 6.2240663900414933E-3 | H98: =7*RC[-1] -> 4.3568464730290454E-2 | I98: =10000*RC[-2] -> 62.240663900414937 | J98: =LOG10(RC[-1]) -> 1.7940742164808128 | K98: =1.75*RC[-1] -> 3.1396298788414225 | L98: =11*LOG10(RC[-2]) -> 2.7922444526312713
A99: 3 | B99: 3 | C99: kylix_rd | D99: kylix-rd | E99: /development/software-development/delphi/kylix-rd | F99: =2.5*LOG10(RC[-4]+2) -> 1.7474250108400471 | G99: =ABS(RC[-5])/MAX(C[-5]) -> 6.2240663900414933E-3 | H99: =7*RC[-1] -> 4.3568464730290454E-2 | I99: =10000*RC[-2] -> 62.240663900414937 | J99: =LOG10(RC[-1]) -> 1.7940742164808128 | K99: =1.75*RC[-1] -> 3.1396298788414225 | L99: =11*LOG10(RC[-2]) -> 2.7922444526312713
A100: 4 | B100: 3 | C100: Designer Development | D100: designer-development | E100: /development/software-development/delphi/package-development/designer-development | F100: =2.5*LOG10(RC[-4]+2) -> 1.7474250108400471 | G100: =ABS(RC[-5])/MAX(C[-5]) -> 6.2240663900414933E-3 | H100: =7*RC[-1] -> 4.3568464730290454E-2 | I100: =10000*RC[-2] -> 62.240663900414937 | J100: =LOG10(RC[-1]) -> 1.7940742164808128 | K100: =1.75*RC[-1] -> 3.1396298788414225 | L100: =11*LOG10(RC[-2]) -> 2.7922444526312713
A101: 3 | B101: 3 | C101: PHP | D101: php | E101: /development/software-development/scripting/php | F101: =2.5*LOG10(RC[-4]+2) -> 1.7474250108400471 | G101: =ABS(RC[-5])/MAX(C[-5]) -> 6.2240663900414933E-3 | H101: =7*RC[-1] -> 4.3568464730290454E-2 | I101: =10000*RC[-2] -> 62.240663900414937 | J101: =LOG10(RC[-1]) -> 1.7940742164808128 | K101: =1.75*RC[-1] -> 3.1396298788414225 | L101: =11*LOG10(RC[-2]) -> 2.7922444526312713
A102: 3 | B102: 3 | C102: PowerShell | D102: powershell | E102: /development/software-development/scripting/powershell | F102: =2.5*LOG10(RC[-4]+2) -> 1.7474250108400471 | G102: =ABS(RC[-5])/MAX(C[-5]) -> 6.2240663900414933E-3 | H102: =7*RC[-1] -> 4.3568464730290454E-2 | I102: =10000*RC[-2] -> 62.240663900414937 | J102: =LOG10(RC[-1]) -> 1.7940742164808128 | K102: =1.75*RC[-1] -> 3.1396298788414225 | L102: =11*LOG10(RC[-2]) -> 2.7922444526312713
A103: 3 | B103: 3 | C103: CodePlex | D103: codeplex | E103: /development/source-code-management/tfs--team-foundation-system-/codeplex | F103: =2.5*LOG10(RC[-4]+2) -> 1.7474250108400471 | G103: =ABS(RC[-5])/MAX(C[-5]) -> 6.2240663900414933E-3 | H103: =7*RC[-1] -> 4.3568464730290454E-2 | I103: =10000*RC[-2] -> 62.240663900414937 | J103: =LOG10(RC[-1]) -> 1.7940742164808128 | K103: =1.75*RC[-1] -> 3.1396298788414225 | L103: =11*LOG10(RC[-2]) -> 2.7922444526312713
A104: 1 | B104: 3 | C104: PowerDay | D104: powerday | E104: /event/powerday | F104: =2.5*LOG10(RC[-4]+2) -> 1.7474250108400471 | G104: =ABS(RC[-5])/MAX(C[-5]) -> 6.2240663900414933E-3 | H104: =7*RC[-1] -> 4.3568464730290454E-2 | I104: =10000*RC[-2] -> 62.240663900414937 | J104: =LOG10(RC[-1]) -> 1.7940742164808128 | K104: =1.75*RC[-1] -> 3.1396298788414225 | L104: =11*LOG10(RC[-2]) -> 2.7922444526312713
A105: 0 | B105: 3 | C105: History | D105: history | E105: /history | F105: =2.5*LOG10(RC[-4]+2) -> 1.7474250108400471 | G105: =ABS(RC[-5])/MAX(C[-5]) -> 6.2240663900414933E-3 | H105: =7*RC[-1] -> 4.3568464730290454E-2 | I105: =10000*RC[-2] -> 62.240663900414937 | J105: =LOG10(RC[-1]) -> 1.7940742164808128 | K105: =1.75*RC[-1] -> 3.1396298788414225 | L105: =11*LOG10(RC[-2]) -> 2.7922444526312713
A106: 2 | B106: 3 | C106: Endian | D106: endian | E106: /power-user/nix/endian | F106: =2.5*LOG10(RC[-4]+2) -> 1.7474250108400471 | G106: =ABS(RC[-5])/MAX(C[-5]) -> 6.2240663900414933E-3 | H106: =7*RC[-1] -> 4.3568464730290454E-2 | I106: =10000*RC[-2] -> 62.240663900414937 | J106: =LOG10(RC[-1]) -> 1.7940742164808128 | K106: =1.75*RC[-1] -> 3.1396298788414225 | L106: =11*LOG10(RC[-2]) -> 2.7922444526312713
A107: 2 | B107: 3 | C107: GMail | D107: gmail | E107: /power-user/google/gmail | F107: =2.5*LOG10(RC[-4]+2) -> 1.7474250108400471 | G107: =ABS(RC[-5])/MAX(C[-5]) -> 6.2240663900414933E-3 | H107: =7*RC[-1] -> 4.3568464730290454E-2 | I107: =10000*RC[-2] -> 62.240663900414937 | J107: =LOG10(RC[-1]) -> 1.7940742164808128 | K107: =1.75*RC[-1] -> 3.1396298788414225 | L107: =11*LOG10(RC[-2]) -> 2.7922444526312713
A108: 2 | B108: 3 | C108: GoogleSearch | D108: googlesearch | E108: /power-user/google/googlesearch | F108: =2.5*LOG10(RC[-4]+2) -> 1.7474250108400471 | G108: =ABS(RC[-5])/MAX(C[-5]) -> 6.2240663900414933E-3 | H108: =7*RC[-1] -> 4.3568464730290454E-2 | I108: =10000*RC[-2] -> 62.240663900414937 | J108: =LOG10(RC[-1]) -> 1.7940742164808128 | K108: =1.75*RC[-1] -> 3.1396298788414225 | L108: =11*LOG10(RC[-2]) -> 2.7922444526312713
A109: 2 | B109: 3 | C109: HTC Sensation | D109: htc-sensation | E109: /power-user/htc/htc-sensation | F109: =2.5*LOG10(RC[-4]+2) -> 1.7474250108400471 | G109: =ABS(RC[-5])/MAX(C[-5]) -> 6.2240663900414933E-3 | H109: =7*RC[-1] -> 4.3568464730290454E-2 | I109: =10000*RC[-2] -> 62.240663900414937 | J109: =LOG10(RC[-1]) -> 1.7940742164808128 | K109: =1.75*RC[-1] -> 3.1396298788414225 | L109: =11*LOG10(RC[-2]) -> 2.7922444526312713
A110: 1 | B110: 3 | C110: Internet | D110: internet | E110: /power-user/internet | F110: =2.5*LOG10(RC[-4]+2) -> 1.7474250108400471 | G110: =ABS(RC[-5])/MAX(C[-5]) -> 6.2240663900414933E-3 | H110: =7*RC[-1] -> 4.3568464730290454E-2 | I110: =10000*RC[-2] -> 62.240663900414937 | J110: =LOG10(RC[-1]) -> 1.7940742164808128 | K110: =1.75*RC[-1] -> 3.1396298788414225 | L110: =11*LOG10(RC[-2]) -> 2.7922444526312713
A111: 1 | B111: 3 | C111: Network-and-equipment | D111: network-and-equipment | E111: /power-user/network-and-equipment | F111: =2.5*LOG10(RC[-4]+2) -> 1.7474250108400471 | G111: =ABS(RC[-5])/MAX(C[-5]) -> 6.2240663900414933E-3 | H111: =7*RC[-1] -> 4.3568464730290454E-2 | I111: =10000*RC[-2] -> 62.240663900414937 | J111: =LOG10(RC[-1]) -> 1.7940742164808128 | K111: =1.75*RC[-1] -> 3.1396298788414225 | L111: =11*LOG10(RC[-2]) -> 2.7922444526312713
A112: 2 | B112: 3 | C112: Fritz!Box | D112: fritz-box | E112: /power-user/network-and-equipment/fritz-box | F112: =2.5*LOG10(RC[-4]+2) -> 1.7474250108400471 | G112: =ABS(RC[-5])/MAX(C[-5]) -> 6.2240663900414933E-3 | H112: =7*RC[-1] -> 4.3568464730290454E-2 | I112: =10000*RC[-2] -> 62.240663900414937 | J112: =LOG10(RC[-1]) -> 1.7940742164808128 | K112: =1.75*RC[-1] -> 3.1396298788414225 | L112: =11*LOG10(RC[-2]) -> 2.7922444526312713
A113: 2 | B113: 3 | C113: Fusion | D113: fusion | E113: /power-user/vmware/fusion | F113: =2.5*LOG10(RC[-4]+2) -> 1.7474250108400471 | G113: =ABS(RC[-5])/MAX(C[-5]) -> 6.2240663900414933E-3 | H113: =7*RC[-1] -> 4.3568464730290454E-2 | I113: =10000*RC[-2] -> 62.240663900414937 | J113: =LOG10(RC[-1]) -> 1.7940742164808128 | K113: =1.75*RC[-1] -> 3.1396298788414225 | L113: =11*LOG10(RC[-2]) -> 2.7922444526312713
A114: 4 | B114: 3 | C114: Veeam | D114: veeam | E114: /power-user/vmware/vmware-esxi/esxi4/veeam | F114: =2.5*LOG10(RC[-4]+2) -> 1.7474250108400471 | G114: =ABS(RC[-5])/MAX(C[-5]) -> 6.2240663900414933E-3 | H114: =7*RC[-1] -> 4.3568464730290454E-2 | I114: =10000*RC[-2] -> 62.240663900414937 | J114: =LOG10(RC[-1]) -> 1.7940742164808128 | K114: =1.75*RC[-1] -> 3.1396298788414225 | L114: =11*LOG10(RC[-2]) -> 2.7922444526312713
A115: 1 | B115: 3 | C115: Twitter | D115: twitter | E115: /socialmedia/twitter | F115: =2.5*LOG10(RC[-4]+2) -> 1.7474250108400471 | G115: =ABS(RC[-5])/MAX(C[-5]) -> 6.2240663900414933E-3 | H115: =7*RC[-1] -> 4.3568464730290454E-2 | I115: =10000*RC[-2] -> 62.240663900414937 | J115: =LOG10(RC[-1]) -> 1.7940742164808128 | K115: =1.75*RC[-1] -> 3.1396298788414225 | L115: =11*LOG10(RC[-2]) -> 2.7922444526312713
A116: 0 | B116: 3 | C116: User Experience | D116: user-experience | E116: /user-experience | F116: =2.5*LOG10(RC[-4]+2) -> 1.7474250108400471 | G116: =ABS(RC[-5])/MAX(C[-5]) -> 6.2240663900414933E-3 | H116: =7*RC[-1] -> 4.3568464730290454E-2 | I116: =10000*RC[-2] -> 62.240663900414937 | J116: =LOG10(RC[-1]) -> 1.7940742164808128 | K116: =1.75*RC[-1] -> 3.1396298788414225 | L116: =11*LOG10(RC[-2]) -> 2.7922444526312713
A117: 2 | B117: 4 | C117: Access | D117: access | E117: /development/database-development/access | F117: =2.5*LOG10(RC[-4]+2) -> 1.9453781259591092 | G117: =ABS(RC[-5])/MAX(C[-5]) -> 8.2987551867219917E-3 | H117: =7*RC[-1] -> 5.8091286307053944E-2 | I117: =10000*RC[-2] -> 82.987551867219921 | J117: =LOG10(RC[-1]) -> 1.9190129530891129 | K117: =1.75*RC[-1] -> 3.3582726679059478 | L117: =11*LOG10(RC[-2]) -> 3.1138569679461208
A118: 3 | B118: 4 | C118: SQL Server 2000 | D118: sql-server-2000 | E118: /development/database-development/sql-server/sql-server-2000 | F118: =2.5*LOG10(RC[-4]+2) -> 1.9453781259591092 | G118: =ABS(RC[-5])/MAX(C[-5]) -> 8.2987551867219917E-3 | H118: =7*RC[-1] -> 5.8091286307053944E-2 | I118: =10000*RC[-2] -> 82.987551867219921 | J118: =LOG10(RC[-1]) -> 1.9190129530891129 | K118: =1.75*RC[-1] -> 3.3582726679059478 | L118: =11*LOG10(RC[-2]) -> 3.1138569679461208
A119: 2 | B119: 4 | C119: Agile | D119: agile | E119: /development/software-development/agile | F119: =2.5*LOG10(RC[-4]+2) -> 1.9453781259591092 | G119: =ABS(RC[-5])/MAX(C[-5]) -> 8.2987551867219917E-3 | H119: =7*RC[-1] -> 5.8091286307053944E-2 | I119: =10000*RC[-2] -> 82.987551867219921 | J119: =LOG10(RC[-1]) -> 1.9190129530891129 | K119: =1.75*RC[-1] -> 3.3582726679059478 | L119: =11*LOG10(RC[-2]) -> 3.1138569679461208
A120: 3 | B120: 4 | C120: Delphi for PHP | D120: delphi-for-php | E120: /development/software-development/delphi/delphi-for-php | F120: =2.5*LOG10(RC[-4]+2) -> 1.9453781259591092 | G120: =ABS(RC[-5])/MAX(C[-5]) -> 8.2987551867219917E-3 | H120: =7*RC[-1] -> 5.8091286307053944E-2 | I120: =10000*RC[-2] -> 82.987551867219921 | J120: =LOG10(RC[-1]) -> 1.9190129530891129 | K120: =1.75*RC[-1] -> 3.3582726679059478 | L120: =11*LOG10(RC[-2]) -> 3.1138569679461208
A121: 3 | B121: 4 | C121: FastMM | D121: fastmm | E121: /development/software-development/delphi/fastmm | F121: =2.5*LOG10(RC[-4]+2) -> 1.9453781259591092 | G121: =ABS(RC[-5])/MAX(C[-5]) -> 8.2987551867219917E-3 | H121: =7*RC[-1] -> 5.8091286307053944E-2 | I121: =10000*RC[-2] -> 82.987551867219921 | J121: =LOG10(RC[-1]) -> 1.9190129530891129 | K121: =1.75*RC[-1] -> 3.3582726679059478 | L121: =11*LOG10(RC[-2]) -> 3.1138569679461208
A122: 2 | B122: 4 | C122: RegEx | D122: regex | E122: /development/software-development/regex | F122: =2.5*LOG10(RC[-4]+2) -> 1.9453781259591092 | G122: =ABS(RC[-5])/MAX(C[-5]) -> 8.2987551867219917E-3 | H122: =7*RC[-1] -> 5.8091286307053944E-2 | I122: =10000*RC[-2] -> 82.987551867219921 | J122: =LOG10(RC[-1]) -> 1.9190129530891129 | K122: =1.75*RC[-1] -> 3.3582726679059478 | L122: =11*LOG10(RC[-2]) -> 3.1138569679461208
A123: 2 | B123: 4 | C123: UI Design | D123: ui-design | E123: /development/software-development/ui-design | F123: =2.5*LOG10(RC[-4]+2) -> 1.9453781259591092 | G123: =ABS(RC[-5])/MAX(C[-5]) -> 8.2987551867219917E-3 | H123: =7*RC[-1] -> 5.8091286307053944E-2 | I123: =10000*RC[-2] -> 82.987551867219921 | J123: =LOG10(RC[-1]) -> 1.9190129530891129 | K123: =1.75*RC[-1] -> 3.3582726679059478 | L123: =11*LOG10(RC[-2]) -> 3.1138569679461208
A124: 2 | B124: 4 | C124: VBS | D124: vbs | E124: /development/software-development/vbs | F124: =2.5*LOG10(RC[-4]+2) -> 1.9453781259591092 | G124: =ABS(RC[-5])/MAX(C[-5]) -> 8.2987551867219917E-3 | H124: =7*RC[-1] -> 5.8091286307053944E-2 | I124: =10000*RC[-2] -> 82.987551867219921 | J124: =LOG10(RC[-1]) -> 1.9190129530891129 | K124: =1.75*RC[-1] -> 3.3582726679059478 | L124: =11*LOG10(RC[-2]) -> 3.1138569679461208
A125: 2 | B125: 4 | C125: Subversion/SVN | D125: subversion-svn | E125: /development/source-code-management/subversion-svn | F125: =2.5*LOG10(RC[-4]+2) -> 1.9453781259591092 | G125: =ABS(RC[-5])/MAX(C[-5]) -> 8.2987551867219917E-3 | H125: =7*RC[-1] -> 5.8091286307053944E-2 | I125: =10000*RC[-2] -> 82.987551867219921 | J125: =LOG10(RC[-1]) -> 1.9190129530891129 | K125: =1.75*RC[-1] -> 3.3582726679059478 | L125: =11*LOG10(RC[-2]) -> 3.1138569679461208
A126: 2 | B126: 4 | C126: BASTA! | D126: basta- | E126: /event/conferences/basta- | F126: =2.5*LOG10(RC[-4]+2) -> 1.9453781259591092 | G126: =ABS(RC[-5])/MAX(C[-5]) -> 8.2987551867219917E-3 | H126: =7*RC[-1] -> 5.8091286307053944E-2 | I126: =10000*RC[-2] -> 82.987551867219921 | J126: =LOG10(RC[-1]) -> 1.9190129530891129 | K126: =1.75*RC[-1] -> 3.3582726679059478 | L126: =11*LOG10(RC[-2]) -> 3.1138569679461208
A127: 2 | B127: 4 | C127: CodeRage | D127: coderage | E127: /event/conferences/coderage | F127: =2.5*LOG10(RC[-4]+2) -> 1.9453781259591092 | G127: =ABS(RC[-5])/MAX(C[-5]) -> 8.2987551867219917E-3 | H127: =7*RC[-1] -> 5.8091286307053944E-2 | I127: =10000*RC[-2] -> 82.987551867219921 | J127: =LOG10(RC[-1]) -> 1.9190129530891129 | K127: =1.75*RC[-1] -> 3.3582726679059478 | L127: =11*LOG10(RC[-2]) -> 3.1138569679461208
A128: 2 | B128: 4 | C128: DelphiLive | D128: delphilive | E128: /event/conferences/delphilive | F128: =2.5*LOG10(RC[-4]+2) -> 1.9453781259591092 | G128: =ABS(RC[-5])/MAX(C[-5]) -> 8.2987551867219917E-3 | H128: =7*RC[-1] -> 5.8091286307053944E-2 | I128: =10000*RC[-2] -> 82.987551867219921 | J128: =LOG10(RC[-1]) -> 1.9190129530891129 | K128: =1.75*RC[-1] -> 3.3582726679059478 | L128: =11*LOG10(RC[-2]) -> 3.1138569679461208
A129: 2 | B129: 4 | C129: EKON | D129: ekon | E129: /event/conferences/ekon | F129: =2.5*LOG10(RC[-4]+2) -> 1.9453781259591092 | G129: =ABS(RC[-5])/MAX(C[-5]) -> 8.2987551867219917E-3 | H129: =7*RC[-1] -> 5.8091286307053944E-2 | I129: =10000*RC[-2] -> 82.987551867219921 | J129: =LOG10(RC[-1]) -> 1.9190129530891129 | K129: =1.75*RC[-1] -> 3.3582726679059478 | L129: =11*LOG10(RC[-2]) -> 3.1138569679461208
A130: 1 | B130: 4 | C130: Font | D130: font | E130: /power-user/font | F130: =2.5*LOG10(RC[-4]+2) -> 1.9453781259591092 | G130: =ABS(RC[-5])/MAX(C[-5]) -> 8.2987551867219917E-3 | H130: =7*RC[-1] -> 5.8091286307053944E-2 | I130: =10000*RC[-2] -> 82.987551867219921 | J130: =LOG10(RC[-1]) -> 1.9190129530891129 | K130: =1.75*RC[-1] -> 3.3582726679059478 | L130: =11*LOG10(RC[-2]) -> 3.1138569679461208
A131: 1 | B131: 4 | C131: HTC | D131: htc | E131: /power-user/htc | F131: =2.5*LOG10(RC[-4]+2) -> 1.9453781259591092 | G131: =ABS(RC[-5])/MAX(C[-5]) -> 8.2987551867219917E-3 | H131: =7*RC[-1] -> 5.8091286307053944E-2 | I131: =10000*RC[-2] -> 82.987551867219921 | J131: =LOG10(RC[-1]) -> 1.9190129530891129 | K131: =1.75*RC[-1] -> 3.3582726679059478 | L131: =11*LOG10(RC[-2]) -> 3.1138569679461208
A132: 2 | B132: 4 | C132: iPhone | D132: iphone | E132: /power-user/ios/iphone | F132: =2.5*LOG10(RC[-4]+2) -> 1.9453781259591092 | G132: =ABS(RC[-5])/MAX(C[-5]) -> 8.2987551867219917E-3 | H132: =7*RC[-1] -> 5.8091286307053944E-2 | I132: =10000*RC[-2] -> 82.987551867219921 | J132: =LOG10(RC[-1]) -> 1.9190129530891129 | K132: =1.75*RC[-1] -> 3.3582726679059478 | L132: =11*LOG10(RC[-2]) -> 3.1138569679461208
A133: 1 | B133: 4 | C133: ThinkPad | D133: thinkpad | E133: /power-user/thinkpad | F133: =2.5*LOG10(RC[-4]+2) -> 1.9453781259591092 | G133: =ABS(RC[-5])/MAX(C[-5]) -> 8.2987551867219917E-3 | H133: =7*RC[-1] -> 5.8091286307053944E-2 | I133: =10000*RC[-2] -> 82.987551867219921 | J133: =LOG10(RC[-1]) -> 1.9190129530891129 | K133: =1.75*RC[-1] -> 3.3582726679059478 | L133: =11*LOG10(RC[-2]) -> 3.1138569679461208
A134: 2 | B134: 4 | C134: W701 | D134: w701 | E134: /power-user/thinkpad/w701 | F134: =2.5*LOG10(RC[-4]+2) -> 1.9453781259591092 | G134: =ABS(RC[-5])/MAX(C[-5]) -> 8.2987551867219917E-3 | H134: =7*RC[-1] -> 5.8091286307053944E-2 | I134: =10000*RC[-2] -> 82.987551867219921 | J134: =LOG10(RC[-1]) -> 1.9190129530891129 | K134: =1.75*RC[-1] -> 3.3582726679059478 | L134: =11*LOG10(RC[-2]) -> 3.1138569679461208
A135: 0 | B135: 4 | C135: Usability | D135: usability | E135: /usability | F135: =2.5*LOG10(RC[-4]+2) -> 1.9453781259591092 | G135: =ABS(RC[-5])/MAX(C[-5]) -> 8.2987551867219917E-3 | H135: =7*RC[-1] -> 5.8091286307053944E-2 | I135: =10000*RC[-2] -> 82.987551867219921 | J135: =LOG10(RC[-1]) -> 1.9190129530891129 | K135: =1.75*RC[-1] -> 3.3582726679059478 | L135: =11*LOG10(RC[-2]) -> 3.1138569679461208
A136: 2 | B136: 5 | C136: Travel | D136: travel | E136: /about/personal/travel | F136: =2.5*LOG10(RC[-4]+2) -> 2.1127451000356419 | G136: =ABS(RC[-5])/MAX(C[-5]) -> 1.0373443983402489E-2 | H136: =7*RC[-1] -> 7.2614107883817419E-2 | I136: =10000*RC[-2] -> 103.7344398340249 | J136: =LOG10(RC[-1]) -> 2.0159229660971691 | K136: =1.75*RC[-1] -> 3.5278651906700462 | L136: =11*LOG10(RC[-2]) -> 3.3492132576813116
A137: 1 | B137: 5 | C137: Hardware Interfacing | D137: hardware-interfacing | E137: /development/hardware-interfacing | F137: =2.5*LOG10(RC[-4]+2) -> 2.1127451000356419 | G137: =ABS(RC[-5])/MAX(C[-5]) -> 1.0373443983402489E-2 | H137: =7*RC[-1] -> 7.2614107883817419E-2 | I137: =10000*RC[-2] -> 103.7344398340249 | J137: =LOG10(RC[-1]) -> 2.0159229660971691 | K137: =1.75*RC[-1] -> 3.5278651906700462 | L137: =11*LOG10(RC[-2]) -> 3.3492132576813116
A138: 3 | B138: 5 | C138: MonoTouch | D138: monotouch | E138: /development/software-development/net/monotouch | F138: =2.5*LOG10(RC[-4]+2) -> 2.1127451000356419 | G138: =ABS(RC[-5])/MAX(C[-5]) -> 1.0373443983402489E-2 | H138: =7*RC[-1] -> 7.2614107883817419E-2 | I138: =10000*RC[-2] -> 103.7344398340249 | J138: =LOG10(RC[-1]) -> 2.0159229660971691 | K138: =1.75*RC[-1] -> 3.5278651906700462 | L138: =11*LOG10(RC[-2]) -> 3.3492132576813116
A139: 3 | B139: 5 | C139: WPF | D139: wpf | E139: /development/software-development/net/wpf | F139: =2.5*LOG10(RC[-4]+2) -> 2.1127451000356419 | G139: =ABS(RC[-5])/MAX(C[-5]) -> 1.0373443983402489E-2 | H139: =7*RC[-1] -> 7.2614107883817419E-2 | I139: =10000*RC[-2] -> 103.7344398340249 | J139: =LOG10(RC[-1]) -> 2.0159229660971691 | K139: =1.75*RC[-1] -> 3.5278651906700462 | L139: =11*LOG10(RC[-2]) -> 3.3492132576813116
A140: 3 | B140: 5 | C140: Delphi XE2 | D140: delphi-xe2 | E140: /development/software-development/delphi/delphi-xe2 | F140: =2.5*LOG10(RC[-4]+2) -> 2.1127451000356419 | G140: =ABS(RC[-5])/MAX(C[-5]) -> 1.0373443983402489E-2 | H140: =7*RC[-1] -> 7.2614107883817419E-2 | I140: =10000*RC[-2] -> 103.7344398340249 | J140: =LOG10(RC[-1]) -> 2.0159229660971691 | K140: =1.75*RC[-1] -> 3.5278651906700462 | L140: =11*LOG10(RC[-2]) -> 3.3492132576813116
A141: 4 | B141: 5 | C141: HTML5 | D141: html5 | E141: /development/software-development/web-development/html/html5 | F141: =2.5*LOG10(RC[-4]+2) -> 2.1127451000356419 | G141: =ABS(RC[-5])/MAX(C[-5]) -> 1.0373443983402489E-2 | H141: =7*RC[-1] -> 7.2614107883817419E-2 | I141: =10000*RC[-2] -> 103.7344398340249 | J141: =LOG10(RC[-1]) -> 2.0159229660971691 | K141: =1.75*RC[-1] -> 3.5278651906700462 | L141: =11*LOG10(RC[-2]) -> 3.3492132576813116
A142: 4 | B142: 5 | C142: MacBook-Air | D142: macbook-air | E142: /power-user/apple/mac/macbook/macbook-air | F142: =2.5*LOG10(RC[-4]+2) -> 2.1127451000356419 | G142: =ABS(RC[-5])/MAX(C[-5]) -> 1.0373443983402489E-2 | H142: =7*RC[-1] -> 7.2614107883817419E-2 | I142: =10000*RC[-2] -> 103.7344398340249 | J142: =LOG10(RC[-1]) -> 2.0159229660971691 | K142: =1.75*RC[-1] -> 3.5278651906700462 | L142: =11*LOG10(RC[-2]) -> 3.3492132576813116
A143: 1 | B143: 5 | C143: Google Apps | D143: google-apps | E143: /power-user/google-apps | F143: =2.5*LOG10(RC[-4]+2) -> 2.1127451000356419 | G143: =ABS(RC[-5])/MAX(C[-5]) -> 1.0373443983402489E-2 | H143: =7*RC[-1] -> 7.2614107883817419E-2 | I143: =10000*RC[-2] -> 103.7344398340249 | J143: =LOG10(RC[-1]) -> 2.0159229660971691 | K143: =1.75*RC[-1] -> 3.5278651906700462 | L143: =11*LOG10(RC[-2]) -> 3.3492132576813116
A144: 1 | B144: 6 | C144: Mobile Development | D144: mobile-development | E144: /development/mobile-development | F144: =2.5*LOG10(RC[-4]+2) -> 2.257724967479859 | G144: =ABS(RC[-5])/MAX(C[-5]) -> 1.2448132780082987E-2 | H144: =7*RC[-1] -> 8.7136929460580909E-2 | I144: =10000*RC[-2] -> 124.48132780082987 | J144: =LOG10(RC[-1]) -> 2.0951042121447943 | K144: =1.75*RC[-1] -> 3.6664323712533902 | L144: =11*LOG10(RC[-2]) -> 3.5332619299063168
A145: 4 | B145: 6 | C145: Visual Studio 2008 | D145: visual-studio-2008 | E145: /development/software-development/net/visual-studio-and-tools/visual-studio-2008 | F145: =2.5*LOG10(RC[-4]+2) -> 2.257724967479859 | G145: =ABS(RC[-5])/MAX(C[-5]) -> 1.2448132780082987E-2 | H145: =7*RC[-1] -> 8.7136929460580909E-2 | I145: =10000*RC[-2] -> 124.48132780082987 | J145: =LOG10(RC[-1]) -> 2.0951042121447943 | K145: =1.75*RC[-1] -> 3.6664323712533902 | L145: =11*LOG10(RC[-2]) -> 3.5332619299063168
A146: 2 | B146: 6 | C146: MQ Message Queueing/Queuing | D146: mq-message-queueing-queuing | E146: /development/software-development/mq-message-queueing-queuing | F146: =2.5*LOG10(RC[-4]+2) -> 2.257724967479859 | G146: =ABS(RC[-5])/MAX(C[-5]) -> 1.2448132780082987E-2 | H146: =7*RC[-1] -> 8.7136929460580909E-2 | I146: =10000*RC[-2] -> 124.48132780082987 | J146: =LOG10(RC[-1]) -> 2.0951042121447943 | K146: =1.75*RC[-1] -> 3.6664323712533902 | L146: =11*LOG10(RC[-2]) -> 3.5332619299063168
A147: 3 | B147: 6 | C147: WebSphere MQ | D147: websphere-mq | E147: /development/software-development/mq-message-queueing-queuing/websphere-mq | F147: =2.5*LOG10(RC[-4]+2) -> 2.257724967479859 | G147: =ABS(RC[-5])/MAX(C[-5]) -> 1.2448132780082987E-2 | H147: =7*RC[-1] -> 8.7136929460580909E-2 | I147: =10000*RC[-2] -> 124.48132780082987 | J147: =LOG10(RC[-1]) -> 2.0951042121447943 | K147: =1.75*RC[-1] -> 3.6664323712533902 | L147: =11*LOG10(RC[-2]) -> 3.5332619299063168
A148: 1 | B148: 6 | C148: XP-embedded | D148: xp-embedded | E148: /development/xp-embedded | F148: =2.5*LOG10(RC[-4]+2) -> 2.257724967479859 | G148: =ABS(RC[-5])/MAX(C[-5]) -> 1.2448132780082987E-2 | H148: =7*RC[-1] -> 8.7136929460580909E-2 | I148: =10000*RC[-2] -> 124.48132780082987 | J148: =LOG10(RC[-1]) -> 2.0951042121447943 | K148: =1.75*RC[-1] -> 3.6664323712533902 | L148: =11*LOG10(RC[-2]) -> 3.5332619299063168
A149: 1 | B149: 6 | C149: Android | D149: android | E149: /power-user/android | F149: =2.5*LOG10(RC[-4]+2) -> 2.257724967479859 | G149: =ABS(RC[-5])/MAX(C[-5]) -> 1.2448132780082987E-2 | H149: =7*RC[-1] -> 8.7136929460580909E-2 | I149: =10000*RC[-2] -> 124.48132780082987 | J149: =LOG10(RC[-1]) -> 2.0951042121447943 | K149: =1.75*RC[-1] -> 3.6664323712533902 | L149: =11*LOG10(RC[-2]) -> 3.5332619299063168
A150: 2 | B150: 6 | C150: iPad | D150: ipad | E150: /power-user/ios/ipad | F150: =2.5*LOG10(RC[-4]+2) -> 2.257724967479859 | G150: =ABS(RC[-5])/MAX(C[-5]) -> 1.2448132780082987E-2 | H150: =7*RC[-1] -> 8.7136929460580909E-2 | I150: =10000*RC[-2] -> 124.48132780082987 | J150: =LOG10(RC[-1]) -> 2.0951042121447943 | K150: =1.75*RC[-1] -> 3.6664323712533902 | L150: =11*LOG10(RC[-2]) -> 3.5332619299063168
A151: 1 | B151: 6 | C151: WordPress | D151: wordpress | E151: /socialmedia/wordpress | F151: =2.5*LOG10(RC[-4]+2) -> 2.257724967479859 | G151: =ABS(RC[-5])/MAX(C[-5]) -> 1.2448132780082987E-2 | H151: =7*RC[-1] -> 8.7136929460580909E-2 | I151: =10000*RC[-2] -> 124.48132780082987 | J151: =LOG10(RC[-1]) -> 2.0951042121447943 | K151: =1.75*RC[-1] -> 3.6664323712533902 | L151: =11*LOG10(RC[-2]) -> 3.5332619299063168
A152: 2 | B152: 7 | C152: Adest Musica | D152: adest-musica | E152: /about/personal/adest-musica | F152: =2.5*LOG10(RC[-4]+2) -> 2.3856062735983121 | G152: =ABS(RC[-5])/MAX(C[-5]) -> 1.4522821576763486E-2 | H152: =7*RC[-1] -> 0.1016597510373444 | I152: =10000*RC[-2] -> 145.22821576763485 | J152: =LOG10(RC[-1]) -> 2.1620510017754073 | K152: =1.75*RC[-1] -> 3.783589253106963 | L152: =11*LOG10(RC[-2]) -> 3.6835252799678679
A153: 2 | B153: 7 | C153: SQL | D153: sql | E153: /development/database-development/sql | F153: =2.5*LOG10(RC[-4]+2) -> 2.3856062735983121 | G153: =ABS(RC[-5])/MAX(C[-5]) -> 1.4522821576763486E-2 | H153: =7*RC[-1] -> 0.1016597510373444 | I153: =10000*RC[-2] -> 145.22821576763485 | J153: =LOG10(RC[-1]) -> 2.1620510017754073 | K153: =1.75*RC[-1] -> 3.783589253106963 | L153: =11*LOG10(RC[-2]) -> 3.6835252799678679
A154: 3 | B154: 7 | C154: EF Entity Framework | D154: ef-entity-framework | E154: /development/software-development/net/ef-entity-framework | F154: =2.5*LOG10(RC[-4]+2) -> 2.3856062735983121 | G154: =ABS(RC[-5])/MAX(C[-5]) -> 1.4522821576763486E-2 | H154: =7*RC[-1] -> 0.1016597510373444 | I154: =10000*RC[-2] -> 145.22821576763485 | J154: =LOG10(RC[-1]) -> 2.1620510017754073 | K154: =1.75*RC[-1] -> 3.783589253106963 | L154: =11*LOG10(RC[-2]) -> 3.6835252799678679
A155: 4 | B155: 7 | C155: ISO8859 | D155: iso8859 | E155: /development/software-development/encoding/iso-8859/iso8859 | F155: =2.5*LOG10(RC[-4]+2) -> 2.3856062735983121 | G155: =ABS(RC[-5])/MAX(C[-5]) -> 1.4522821576763486E-2 | H155: =7*RC[-1] -> 0.1016597510373444 | I155: =10000*RC[-2] -> 145.22821576763485 | J155: =LOG10(RC[-1]) -> 2.1620510017754073 | K155: =1.75*RC[-1] -> 3.783589253106963 | L155: =11*LOG10(RC[-2]) -> 3.6835252799678679
A156: 2 | B156: 7 | C156: SOAP/WebServices | D156: soap-webservices | E156: /development/software-development/soap-webservices | F156: =2.5*LOG10(RC[-4]+2) -> 2.3856062735983121 | G156: =ABS(RC[-5])/MAX(C[-5]) -> 1.4522821576763486E-2 | H156: =7*RC[-1] -> 0.1016597510373444 | I156: =10000*RC[-2] -> 145.22821576763485 | J156: =LOG10(RC[-1]) -> 2.1620510017754073 | K156: =1.75*RC[-1] -> 3.783589253106963 | L156: =11*LOG10(RC[-2]) -> 3.6835252799678679
A157: 3 | B157: 7 | C157: CSS | D157: css | E157: /development/software-development/web-development/css | F157: =2.5*LOG10(RC[-4]+2) -> 2.3856062735983121 | G157: =ABS(RC[-5])/MAX(C[-5]) -> 1.4522821576763486E-2 | H157: =7*RC[-1] -> 0.1016597510373444 | I157: =10000*RC[-2] -> 145.22821576763485 | J157: =LOG10(RC[-1]) -> 2.1620510017754073 | K157: =1.75*RC[-1] -> 3.783589253106963 | L157: =11*LOG10(RC[-2]) -> 3.6835252799678679
A158: 2 | B158: 7 | C158: Mac | D158: mac | E158: /power-user/apple/mac | F158: =2.5*LOG10(RC[-4]+2) -> 2.3856062735983121 | G158: =ABS(RC[-5])/MAX(C[-5]) -> 1.4522821576763486E-2 | H158: =7*RC[-1] -> 0.1016597510373444 | I158: =10000*RC[-2] -> 145.22821576763485 | J158: =LOG10(RC[-1]) -> 2.1620510017754073 | K158: =1.75*RC[-1] -> 3.783589253106963 | L158: =11*LOG10(RC[-2]) -> 3.6835252799678679
A159: 3 | B159: 7 | C159: MacBook | D159: macbook | E159: /power-user/apple/mac/macbook | F159: =2.5*LOG10(RC[-4]+2) -> 2.3856062735983121 | G159: =ABS(RC[-5])/MAX(C[-5]) -> 1.4522821576763486E-2 | H159: =7*RC[-1] -> 0.1016597510373444 | I159: =10000*RC[-2] -> 145.22821576763485 | J159: =LOG10(RC[-1]) -> 2.1620510017754073 | K159: =1.75*RC[-1] -> 3.783589253106963 | L159: =11*LOG10(RC[-2]) -> 3.6835252799678679
A160: 3 | B160: 7 | C160: OS X Leopard | D160: os-x-leopard | E160: /power-user/apple/os-x/os-x-leopard | F160: =2.5*LOG10(RC[-4]+2) -> 2.3856062735983121 | G160: =ABS(RC[-5])/MAX(C[-5]) -> 1.4522821576763486E-2 | H160: =7*RC[-1] -> 0.1016597510373444 | I160: =10000*RC[-2] -> 145.22821576763485 | J160: =LOG10(RC[-1]) -> 2.1620510017754073 | K160: =1.75*RC[-1] -> 3.783589253106963 | L160: =11*LOG10(RC[-2]) -> 3.6835252799678679
A161: 3 | B161: 7 | C161: OS X Snow Leopard | D161: os-x-snow-leopard | E161: /power-user/apple/os-x/os-x-snow-leopard | F161: =2.5*LOG10(RC[-4]+2) -> 2.3856062735983121 | G161: =ABS(RC[-5])/MAX(C[-5]) -> 1.4522821576763486E-2 | H161: =7*RC[-1] -> 0.1016597510373444 | I161: =10000*RC[-2] -> 145.22821576763485 | J161: =LOG10(RC[-1]) -> 2.1620510017754073 | K161: =1.75*RC[-1] -> 3.783589253106963 | L161: =11*LOG10(RC[-2]) -> 3.6835252799678679
A162: 1 | B162: 7 | C162: iOS | D162: ios | E162: /power-user/ios | F162: =2.5*LOG10(RC[-4]+2) -> 2.3856062735983121 | G162: =ABS(RC[-5])/MAX(C[-5]) -> 1.4522821576763486E-2 | H162: =7*RC[-1] -> 0.1016597510373444 | I162: =10000*RC[-2] -> 145.22821576763485 | J162: =LOG10(RC[-1]) -> 2.1620510017754073 | K162: =1.75*RC[-1] -> 3.783589253106963 | L162: =11*LOG10(RC[-2]) -> 3.6835252799678679
A163: 4 | B163: 8 | C163: Visual Studio 2005 | D163: visual-studio-2005 | E163: /development/software-development/net/visual-studio-and-tools/visual-studio-2005 | F163: =2.5*LOG10(RC[-4]+2) -> 2.5 | G163: =ABS(RC[-5])/MAX(C[-5]) -> 1.6597510373443983E-2 | H163: =7*RC[-1] -> 0.11618257261410789 | I163: =10000*RC[-2] -> 165.97510373443984 | J163: =LOG10(RC[-1]) -> 2.2200429487530942 | K163: =1.75*RC[-1] -> 3.885075160317915 | L163: =11*LOG10(RC[-2]) -> 3.809975139896904
A164: 3 | B164: 8 | C164: HTML | D164: html | E164: /development/software-development/web-development/html | F164: =2.5*LOG10(RC[-4]+2) -> 2.5 | G164: =ABS(RC[-5])/MAX(C[-5]) -> 1.6597510373443983E-2 | H164: =7*RC[-1] -> 0.11618257261410789 | I164: =10000*RC[-2] -> 165.97510373443984 | J164: =LOG10(RC[-1]) -> 2.2200429487530942 | K164: =1.75*RC[-1] -> 3.885075160317915 | L164: =11*LOG10(RC[-2]) -> 3.809975139896904
A165: 1 | B165: 8 | C165: Web Browsers | D165: web-browsers | E165: /power-user/web-browsers | F165: =2.5*LOG10(RC[-4]+2) -> 2.5 | G165: =ABS(RC[-5])/MAX(C[-5]) -> 1.6597510373443983E-2 | H165: =7*RC[-1] -> 0.11618257261410789 | I165: =10000*RC[-2] -> 165.97510373443984 | J165: =LOG10(RC[-1]) -> 2.2200429487530942 | K165: =1.75*RC[-1] -> 3.885075160317915 | L165: =11*LOG10(RC[-2]) -> 3.809975139896904
A166: 2 | B166: 8 | C166: Chrome | D166: chrome | E166: /power-user/web-browsers/chrome | F166: =2.5*LOG10(RC[-4]+2) -> 2.5 | G166: =ABS(RC[-5])/MAX(C[-5]) -> 1.6597510373443983E-2 | H166: =7*RC[-1] -> 0.11618257261410789 | I166: =10000*RC[-2] -> 165.97510373443984 | J166: =LOG10(RC[-1]) -> 2.2200429487530942 | K166: =1.75*RC[-1] -> 3.885075160317915 | L166: =11*LOG10(RC[-2]) -> 3.809975139896904
A167: 2 | B167: 8 | C167: Windows 8 | D167: windows-8 | E167: /power-user/windows/windows-8 | F167: =2.5*LOG10(RC[-4]+2) -> 2.5 | G167: =ABS(RC[-5])/MAX(C[-5]) -> 1.6597510373443983E-2 | H167: =7*RC[-1] -> 0.11618257261410789 | I167: =10000*RC[-2] -> 165.97510373443984 | J167: =LOG10(RC[-1]) -> 2.2200429487530942 | K167: =1.75*RC[-1] -> 3.885075160317915 | L167: =11*LOG10(RC[-2]) -> 3.809975139896904
A168: 3 | B168: 9 | C168: FireMonkey | D168: firemonkey | E168: /development/software-development/delphi/firemonkey | F168: =2.5*LOG10(RC[-4]+2) -> 2.603481712895563 | G168: =ABS(RC[-5])/MAX(C[-5]) -> 1.8672199170124481E-2 | H168: =7*RC[-1] -> 0.13070539419087138 | I168: =10000*RC[-2] -> 186.7219917012448 | J168: =LOG10(RC[-1]) -> 2.2711954712004752 | K168: =1.75*RC[-1] -> 3.9745920746008316 | L168: =11*LOG10(RC[-2]) -> 3.9187996488149319
A169: 3 | B169: 9 | C169: ISO-8859 | D169: iso-8859 | E169: /development/software-development/encoding/iso-8859 | F169: =2.5*LOG10(RC[-4]+2) -> 2.603481712895563 | G169: =ABS(RC[-5])/MAX(C[-5]) -> 1.8672199170124481E-2 | H169: =7*RC[-1] -> 0.13070539419087138 | I169: =10000*RC[-2] -> 186.7219917012448 | J169: =LOG10(RC[-1]) -> 2.2711954712004752 | K169: =1.75*RC[-1] -> 3.9745920746008316 | L169: =11*LOG10(RC[-2]) -> 3.9187996488149319
A170: 4 | B170: 9 | C170: UTF8 | D170: utf8 | E170: /development/software-development/encoding/utf-8/utf8 | F170: =2.5*LOG10(RC[-4]+2) -> 2.603481712895563 | G170: =ABS(RC[-5])/MAX(C[-5]) -> 1.8672199170124481E-2 | H170: =7*RC[-1] -> 0.13070539419087138 | I170: =10000*RC[-2] -> 186.7219917012448 | J170: =LOG10(RC[-1]) -> 2.2711954712004752 | K170: =1.75*RC[-1] -> 3.9745920746008316 | L170: =11*LOG10(RC[-2]) -> 3.9187996488149319
A171: 2 | B171: 9 | C171: xCode/Mac/iPad/iPhone/iOS/cocoa | D171: xcode-mac-ipad-iphone-ios-cocoa | E171: /development/software-development/xcode-mac-ipad-iphone-ios-cocoa | F171: =2.5*LOG10(RC[-4]+2) -> 2.603481712895563 | G171: =ABS(RC[-5])/MAX(C[-5]) -> 1.8672199170124481E-2 | H171: =7*RC[-1] -> 0.13070539419087138 | I171: =10000*RC[-2] -> 186.7219917012448 | J171: =LOG10(RC[-1]) -> 2.2711954712004752 | K171: =1.75*RC[-1] -> 3.9745920746008316 | L171: =11*LOG10(RC[-2]) -> 3.9187996488149319
A172: 1 | B172: 9 | C172: Stackoverflow | D172: stackoverflow | E172: /pingback/stackoverflow | F172: =2.5*LOG10(RC[-4]+2) -> 2.603481712895563 | G172: =ABS(RC[-5])/MAX(C[-5]) -> 1.8672199170124481E-2 | H172: =7*RC[-1] -> 0.13070539419087138 | I172: =10000*RC[-2] -> 186.7219917012448 | J172: =LOG10(RC[-1]) -> 2.2711954712004752 | K172: =1.75*RC[-1] -> 3.9745920746008316 | L172: =11*LOG10(RC[-2]) -> 3.9187996488149319
A173: 3 | B173: 10 | C173: VB.NET | D173: vb-net | E173: /development/software-development/net/vb-net | F173: =2.5*LOG10(RC[-4]+2) -> 2.6979531151190623 | G173: =ABS(RC[-5])/MAX(C[-5]) -> 2.0746887966804978E-2 | H173: =7*RC[-1] -> 0.14522821576763484 | I173: =10000*RC[-2] -> 207.46887966804979 | J173: =LOG10(RC[-1]) -> 2.3169529617611504 | K173: =1.75*RC[-1] -> 4.0546676830820134 | L173: =11*LOG10(RC[-2]) -> 4.014089386275705
A174: 3 | B174: 10 | C174: WordPress | D174: wordpress | E174: /development/software-development/web-development/wordpress | F174: =2.5*LOG10(RC[-4]+2) -> 2.6979531151190623 | G174: =ABS(RC[-5])/MAX(C[-5]) -> 2.0746887966804978E-2 | H174: =7*RC[-1] -> 0.14522821576763484 | I174: =10000*RC[-2] -> 207.46887966804979 | J174: =LOG10(RC[-1]) -> 2.3169529617611504 | K174: =1.75*RC[-1] -> 4.0546676830820134 | L174: =11*LOG10(RC[-2]) -> 4.014089386275705
A175: 1 | B175: 10 | C175: Keyboards and Keyboard Shortcuts | D175: keyboards-and-keyboard-shortcuts | E175: /power-user/keyboards-and-keyboard-shortcuts | F175: =2.5*LOG10(RC[-4]+2) -> 2.6979531151190623 | G175: =ABS(RC[-5])/MAX(C[-5]) -> 2.0746887966804978E-2 | H175: =7*RC[-1] -> 0.14522821576763484 | I175: =10000*RC[-2] -> 207.46887966804979 | J175: =LOG10(RC[-1]) -> 2.3169529617611504 | K175: =1.75*RC[-1] -> 4.0546676830820134 | L175: =11*LOG10(RC[-2]) -> 4.014089386275705
A176: 3 | B176: 11 | C176: UTF-8 | D176: utf-8 | E176: /development/software-development/encoding/utf-8 | F176: =2.5*LOG10(RC[-4]+2) -> 2.7848583807670919 | G176: =ABS(RC[-5])/MAX(C[-5]) -> 2.2821576763485476E-2 | H176: =7*RC[-1] -> 0.15975103734439833 | I176: =10000*RC[-2] -> 228.21576763485476 | J176: =LOG10(RC[-1]) -> 2.3583456469193753 | K176: =1.75*RC[-1] -> 4.1271048821089069 | L176: =11*LOG10(RC[-2]) -> 4.0986820276186995
A177: 2 | B177: 11 | C177: Java | D177: java | E177: /development/software-development/java | F177: =2.5*LOG10(RC[-4]+2) -> 2.7848583807670919 | G177: =ABS(RC[-5])/MAX(C[-5]) -> 2.2821576763485476E-2 | H177: =7*RC[-1] -> 0.15975103734439833 | I177: =10000*RC[-2] -> 228.21576763485476 | J177: =LOG10(RC[-1]) -> 2.3583456469193753 | K177: =1.75*RC[-1] -> 4.1271048821089069 | L177: =11*LOG10(RC[-2]) -> 4.0986820276186995
A178: 0 | B178: 11 | C178: SocialMedia | D178: socialmedia | E178: /socialmedia | F178: =2.5*LOG10(RC[-4]+2) -> 2.7848583807670919 | G178: =ABS(RC[-5])/MAX(C[-5]) -> 2.2821576763485476E-2 | H178: =7*RC[-1] -> 0.15975103734439833 | I178: =10000*RC[-2] -> 228.21576763485476 | J178: =LOG10(RC[-1]) -> 2.3583456469193753 | K178: =1.75*RC[-1] -> 4.1271048821089069 | L178: =11*LOG10(RC[-2]) -> 4.0986820276186995
A179: 4 | B179: 12 | C179: Component Development | D179: component-development | E179: /development/software-development/delphi/package-development/component-development | F179: =2.5*LOG10(RC[-4]+2) -> 2.865320089195595 | G179: =ABS(RC[-5])/MAX(C[-5]) -> 2.4896265560165973E-2 | H179: =7*RC[-1] -> 0.17427385892116182 | I179: =10000*RC[-2] -> 248.96265560165975 | J179: =LOG10(RC[-1]) -> 2.3961342078087751 | K179: =1.75*RC[-1] -> 4.1932348636653565 | L179: =11*LOG10(RC[-2]) -> 4.1746225322184705
A180: 3 | B180: 12 | C180: JavaScript | D180: javascript | E180: /development/software-development/web-development/javascript | F180: =2.5*LOG10(RC[-4]+2) -> 2.865320089195595 | G180: =ABS(RC[-5])/MAX(C[-5]) -> 2.4896265560165973E-2 | H180: =7*RC[-1] -> 0.17427385892116182 | I180: =10000*RC[-2] -> 248.96265560165975 | J180: =LOG10(RC[-1]) -> 2.3961342078087751 | K180: =1.75*RC[-1] -> 4.1932348636653565 | L180: =11*LOG10(RC[-2]) -> 4.1746225322184705
A181: 0 | B181: 12 | C181: Pingback | D181: pingback | E181: /pingback | F181: =2.5*LOG10(RC[-4]+2) -> 2.865320089195595 | G181: =ABS(RC[-5])/MAX(C[-5]) -> 2.4896265560165973E-2 | H181: =7*RC[-1] -> 0.17427385892116182 | I181: =10000*RC[-2] -> 248.96265560165975 | J181: =LOG10(RC[-1]) -> 2.3961342078087751 | K181: =1.75*RC[-1] -> 4.1932348636653565 | L181: =11*LOG10(RC[-2]) -> 4.1746225322184705
A182: 4 | B182: 13 | C182: Visual Studio 2010 | D182: visual-studio-2010 | E182: /development/software-development/net/visual-studio-and-tools/visual-studio-2010 | F182: =2.5*LOG10(RC[-4]+2) -> 2.9402281476392034 | G182: =ABS(RC[-5])/MAX(C[-5]) -> 2.6970954356846474E-2 | H182: =7*RC[-1] -> 0.18879668049792531 | I182: =10000*RC[-2] -> 269.70954356846477 | J182: =LOG10(RC[-1]) -> 2.4308963140679873 | K182: =1.75*RC[-1] -> 4.2540685496189781 | L182: =11*LOG10(RC[-2]) -> 4.2434307862429552
A183: 2 | B183: 13 | C183: OS X | D183: os-x | E183: /power-user/apple/os-x | F183: =2.5*LOG10(RC[-4]+2) -> 2.9402281476392034 | G183: =ABS(RC[-5])/MAX(C[-5]) -> 2.6970954356846474E-2 | H183: =7*RC[-1] -> 0.18879668049792531 | I183: =10000*RC[-2] -> 269.70954356846477 | J183: =LOG10(RC[-1]) -> 2.4308963140679873 | K183: =1.75*RC[-1] -> 4.2540685496189781 | L183: =11*LOG10(RC[-2]) -> 4.2434307862429552
A184: 3 | B184: 13 | C184: OS X Lion | D184: os-x-lion | E184: /power-user/apple/os-x/os-x-lion | F184: =2.5*LOG10(RC[-4]+2) -> 2.9402281476392034 | G184: =ABS(RC[-5])/MAX(C[-5]) -> 2.6970954356846474E-2 | H184: =7*RC[-1] -> 0.18879668049792531 | I184: =10000*RC[-2] -> 269.70954356846477 | J184: =LOG10(RC[-1]) -> 2.4308963140679873 | K184: =1.75*RC[-1] -> 4.2540685496189781 | L184: =11*LOG10(RC[-2]) -> 4.2434307862429552
A185: 2 | B185: 14 | C185: Firebird | D185: firebird | E185: /development/database-development/firebird | F185: =2.5*LOG10(RC[-4]+2) -> 3.0102999566398121 | G185: =ABS(RC[-5])/MAX(C[-5]) -> 2.9045643153526972E-2 | H185: =7*RC[-1] -> 0.2033195020746888 | I185: =10000*RC[-2] -> 290.4564315352697 | J185: =LOG10(RC[-1]) -> 2.4630809974393886 | K185: =1.75*RC[-1] -> 4.3103917455189302 | L185: =11*LOG10(RC[-2]) -> 4.3062656304284301
A186: 3 | B186: 14 | C186: Package Development | D186: package-development | E186: /development/software-development/delphi/package-development | F186: =2.5*LOG10(RC[-4]+2) -> 3.0102999566398121 | G186: =ABS(RC[-5])/MAX(C[-5]) -> 2.9045643153526972E-2 | H186: =7*RC[-1] -> 0.2033195020746888 | I186: =10000*RC[-2] -> 290.4564315352697 | J186: =LOG10(RC[-1]) -> 2.4630809974393886 | K186: =1.75*RC[-1] -> 4.3103917455189302 | L186: =11*LOG10(RC[-2]) -> 4.3062656304284301
A187: 3 | B187: 14 | C187: Batch-Files | D187: batch-files | E187: /development/software-development/scripting/batch-files | F187: =2.5*LOG10(RC[-4]+2) -> 3.0102999566398121 | G187: =ABS(RC[-5])/MAX(C[-5]) -> 2.9045643153526972E-2 | H187: =7*RC[-1] -> 0.2033195020746888 | I187: =10000*RC[-2] -> 290.4564315352697 | J187: =LOG10(RC[-1]) -> 2.4630809974393886 | K187: =1.75*RC[-1] -> 4.3103917455189302 | L187: =11*LOG10(RC[-2]) -> 4.3062656304284301
A188: 2 | B188: 15 | C188: InterBase | D188: interbase | E188: /development/database-development/interbase | F188: =2.5*LOG10(RC[-4]+2) -> 3.0761223034456848 | G188: =ABS(RC[-5])/MAX(C[-5]) -> 3.1120331950207469E-2 | H188: =7*RC[-1] -> 0.21784232365145229 | I188: =10000*RC[-2] -> 311.20331950207469 | J188: =LOG10(RC[-1]) -> 2.4930442208168317 | K188: =1.75*RC[-1] -> 4.3628273864294558 | L188: =11*LOG10(RC[-2]) -> 4.3640298014277912
A189: 2 | B189: 15 | C189: Debugging | D189: debugging | E189: /development/software-development/debugging | F189: =2.5*LOG10(RC[-4]+2) -> 3.0761223034456848 | G189: =ABS(RC[-5])/MAX(C[-5]) -> 3.1120331950207469E-2 | H189: =7*RC[-1] -> 0.21784232365145229 | I189: =10000*RC[-2] -> 311.20331950207469 | J189: =LOG10(RC[-1]) -> 2.4930442208168317 | K189: =1.75*RC[-1] -> 4.3628273864294558 | L189: =11*LOG10(RC[-2]) -> 4.3640298014277912
A190: 2 | B190: 15 | C190: XSD | D190: xsd | E190: /development/xml-xsd/xsd | F190: =2.5*LOG10(RC[-4]+2) -> 3.0761223034456848 | G190: =ABS(RC[-5])/MAX(C[-5]) -> 3.1120331950207469E-2 | H190: =7*RC[-1] -> 0.21784232365145229 | I190: =10000*RC[-2] -> 311.20331950207469 | J190: =LOG10(RC[-1]) -> 2.4930442208168317 | K190: =1.75*RC[-1] -> 4.3628273864294558 | L190: =11*LOG10(RC[-2]) -> 4.3640298014277912
A191: 2 | B191: 15 | C191: VMware ESXi | D191: vmware-esxi | E191: /power-user/vmware/vmware-esxi | F191: =2.5*LOG10(RC[-4]+2) -> 3.0761223034456848 | G191: =ABS(RC[-5])/MAX(C[-5]) -> 3.1120331950207469E-2 | H191: =7*RC[-1] -> 0.21784232365145229 | I191: =10000*RC[-2] -> 311.20331950207469 | J191: =LOG10(RC[-1]) -> 2.4930442208168317 | K191: =1.75*RC[-1] -> 4.3628273864294558 | L191: =11*LOG10(RC[-2]) -> 4.3640298014277912
A192: 3 | B192: 15 | C192: ESXi4 | D192: esxi4 | E192: /power-user/vmware/vmware-esxi/esxi4 | F192: =2.5*LOG10(RC[-4]+2) -> 3.0761223034456848 | G192: =ABS(RC[-5])/MAX(C[-5]) -> 3.1120331950207469E-2 | H192: =7*RC[-1] -> 0.21784232365145229 | I192: =10000*RC[-2] -> 311.20331950207469 | J192: =LOG10(RC[-1]) -> 2.4930442208168317 | K192: =1.75*RC[-1] -> 4.3628273864294558 | L192: =11*LOG10(RC[-2]) -> 4.3640298014277912
A193: 3 | B193: 16 | C193: Unicode | D193: unicode | E193: /development/software-development/encoding/unicode | F193: =2.5*LOG10(RC[-4]+2) -> 3.1381812627582653 | G193: =ABS(RC[-5])/MAX(C[-5]) -> 3.3195020746887967E-2 | H193: =7*RC[-1] -> 0.23236514522821577 | I193: =10000*RC[-2] -> 331.95020746887968 | J193: =LOG10(RC[-1]) -> 2.5210729444170754 | K193: =1.75*RC[-1] -> 4.4118776527298822 | L193: =11*LOG10(RC[-2]) -> 4.4174395284998704
A194: 1 | B194: 17 | C194: *nix | D194: nix | E194: /power-user/nix | F194: =2.5*LOG10(RC[-4]+2) -> 3.1968840023820722 | G194: =ABS(RC[-5])/MAX(C[-5]) -> 3.5269709543568464E-2 | H194: =7*RC[-1] -> 0.24688796680497926 | I194: =10000*RC[-2] -> 352.69709543568462 | J194: =LOG10(RC[-1]) -> 2.5474018831394245 | K194: =1.75*RC[-1] -> 4.4579532954939927 | L194: =11*LOG10(RC[-2]) -> 4.4670721207391901
A195: 2 | B195: 18 | C195: TFS (Team Foundation System) | D195: tfs--team-foundation-system- | E195: /development/source-code-management/tfs--team-foundation-system- | F195: =2.5*LOG10(RC[-4]+2) -> 3.2525749891599531 | G195: =ABS(RC[-5])/MAX(C[-5]) -> 3.7344398340248962E-2 | H195: =7*RC[-1] -> 0.26141078838174275 | I195: =10000*RC[-2] -> 373.44398340248961 | J195: =LOG10(RC[-1]) -> 2.5722254668644564 | K195: =1.75*RC[-1] -> 4.5013945670127988 | L195: =11*LOG10(RC[-2]) -> 4.5133993711433469
A196: 1 | B196: 18 | C196: Google | D196: google | E196: /power-user/google | F196: =2.5*LOG10(RC[-4]+2) -> 3.2525749891599531 | G196: =ABS(RC[-5])/MAX(C[-5]) -> 3.7344398340248962E-2 | H196: =7*RC[-1] -> 0.26141078838174275 | I196: =10000*RC[-2] -> 373.44398340248961 | J196: =LOG10(RC[-1]) -> 2.5722254668644564 | K196: =1.75*RC[-1] -> 4.5013945670127988 | L196: =11*LOG10(RC[-2]) -> 4.5133993711433469
A197: 2 | B197: 19 | C197: XML | D197: xml | E197: /development/xml-xsd/xml | F197: =2.5*LOG10(RC[-4]+2) -> 3.3055482368347984 | G197: =ABS(RC[-5])/MAX(C[-5]) -> 3.9419087136929459E-2 | H197: =7*RC[-1] -> 0.27593360995850624 | I197: =10000*RC[-2] -> 394.1908713692946 | J197: =LOG10(RC[-1]) -> 2.5957065627139793 | K197: =1.75*RC[-1] -> 4.5424864847494639 | L197: =11*LOG10(RC[-2]) -> 4.5568115465425985
A198: 3 | B198: 20 | C198: ASP.NET | D198: asp-net | E198: /development/software-development/net/asp-net | F198: =2.5*LOG10(RC[-4]+2) -> 3.3560567020555157 | G198: =ABS(RC[-5])/MAX(C[-5]) -> 4.1493775933609957E-2 | H198: =7*RC[-1] -> 0.29045643153526968 | I198: =10000*RC[-2] -> 414.93775933609959 | J198: =LOG10(RC[-1]) -> 2.6179829574251317 | K198: =1.75*RC[-1] -> 4.5814701754939806 | L198: =11*LOG10(RC[-2]) -> 4.5976349655372584
A199: 2 | B199: 22 | C199: Encoding | D199: encoding | E199: /development/software-development/encoding | F199: =2.5*LOG10(RC[-4]+2) -> 3.450528104279015 | G199: =ABS(RC[-5])/MAX(C[-5]) -> 4.5643153526970952E-2 | H199: =7*RC[-1] -> 0.31950207468879666 | I199: =10000*RC[-2] -> 456.43153526970951 | J199: =LOG10(RC[-1]) -> 2.6593756425833566 | K199: =1.75*RC[-1] -> 4.6539073745208741 | L199: =11*LOG10(RC[-2]) -> 4.6725765537331352
A200: 2 | B200: 22 | C200: Scripting | D200: scripting | E200: /development/software-development/scripting | F200: =2.5*LOG10(RC[-4]+2) -> 3.450528104279015 | G200: =ABS(RC[-5])/MAX(C[-5]) -> 4.5643153526970952E-2 | H200: =7*RC[-1] -> 0.31950207468879666 | I200: =10000*RC[-2] -> 456.43153526970951 | J200: =LOG10(RC[-1]) -> 2.6593756425833566 | K200: =1.75*RC[-1] -> 4.6539073745208741 | L200: =11*LOG10(RC[-2]) -> 4.6725765537331352
A201: 1 | B201: 23 | C201: XML/XSD | D201: xml-xsd | E201: /development/xml-xsd | F201: =2.5*LOG10(RC[-4]+2) -> 3.4948500216800942 | G201: =ABS(RC[-5])/MAX(C[-5]) -> 4.7717842323651449E-2 | H201: =7*RC[-1] -> 0.33402489626556015 | I201: =10000*RC[-2] -> 477.1784232365145 | J201: =LOG10(RC[-1]) -> 2.6786807977787435 | K201: =1.75*RC[-1] -> 4.6876913961128013 | L201: =11*LOG10(RC[-2]) -> 4.707130608835647
A202: 0 | B202: 23 | C202: Uncategorized | D202: uncategorized | E202: /uncategorized | F202: =2.5*LOG10(RC[-4]+2) -> 3.4948500216800942 | G202: =ABS(RC[-5])/MAX(C[-5]) -> 4.7717842323651449E-2 | H202: =7*RC[-1] -> 0.33402489626556015 | I202: =10000*RC[-2] -> 477.1784232365145 | J202: =LOG10(RC[-1]) -> 2.6786807977787435 | K202: =1.75*RC[-1] -> 4.6876913961128013 | L202: =11*LOG10(RC[-2]) -> 4.707130608835647
A203: 1 | B203: 24 | C203: Apple | D203: apple | E203: /power-user/apple | F203: =2.5*LOG10(RC[-4]+2) -> 3.537433369927045 | G203: =ABS(RC[-5])/MAX(C[-5]) -> 4.9792531120331947E-2 | H203: =7*RC[-1] -> 0.34854771784232363 | I203: =10000*RC[-2] -> 497.9253112033195 | J203: =LOG10(RC[-1]) -> 2.6971642034727563 | K203: =1.75*RC[-1] -> 4.7200373560773237 | L203: =11*LOG10(RC[-2]) -> 4.7399812583694816
A204: 1 | B204: 25 | C204: Conferences | D204: conferences | E204: /event/conferences | F204: =2.5*LOG10(RC[-4]+2) -> 3.5784094103974686 | G204: =ABS(RC[-5])/MAX(C[-5]) -> 5.1867219917012451E-2 | H204: =7*RC[-1] -> 0.36307053941908718 | I204: =10000*RC[-2] -> 518.67219917012449 | J204: =LOG10(RC[-1]) -> 2.7148929704331879 | K204: =1.75*RC[-1] -> 4.751062698258079 | L204: =11*LOG10(RC[-2]) -> 4.7712798431803582
A205: 2 | B205: 26 | C205: Windows Vista | D205: windows-vista | E205: /power-user/windows/windows-vista | F205: =2.5*LOG10(RC[-4]+2) -> 3.6178950783555481 | G205: =ABS(RC[-5])/MAX(C[-5]) -> 5.3941908713692949E-2 | H205: =7*RC[-1] -> 0.37759336099585061 | I205: =10000*RC[-2] -> 539.41908713692953 | J205: =LOG10(RC[-1]) -> 2.7319263097319686 | K205: =1.75*RC[-1] -> 4.7808710420309453 | L205: =11*LOG10(RC[-2]) -> 4.8011587868349137
A206: 2 | B206: 27 | C206: Windows XP | D206: windows-xp | E206: /power-user/windows/windows-xp | F206: =2.5*LOG10(RC[-4]+2) -> 3.65599499474739 | G206: =ABS(RC[-5])/MAX(C[-5]) -> 5.6016597510373446E-2 | H206: =7*RC[-1] -> 0.3921161825726141 | I206: =10000*RC[-2] -> 560.16597510373447 | J206: =LOG10(RC[-1]) -> 2.7483167259201378 | K206: =1.75*RC[-1] -> 4.8095542703602412 | L206: =11*LOG10(RC[-2]) -> 4.8297345902552982
A207: 3 | B207: 28 | C207: Prism | D207: prism | E207: /development/software-development/net/prism | F207: =2.5*LOG10(RC[-4]+2) -> 3.6928031367991561 | G207: =ABS(RC[-5])/MAX(C[-5]) -> 5.8091286307053944E-2 | H207: =7*RC[-1] -> 0.40663900414937759 | I207: =10000*RC[-2] -> 580.9128630705394 | J207: =LOG10(RC[-1]) -> 2.7641109931033698 | K207: =1.75*RC[-1] -> 4.8371942379308974 | L207: =11*LOG10(RC[-2]) -> 4.8571102600108453
A208: 2 | B208: 29 | C208: CommandLine | D208: commandline | E208: /development/software-development/commandline | F208: =2.5*LOG10(RC[-4]+2) -> 3.7284042345856818 | G208: =ABS(RC[-5])/MAX(C[-5]) -> 6.0165975103734441E-2 | H208: =7*RC[-1] -> 0.42116182572614108 | I208: =10000*RC[-2] -> 601.65975103734445 | J208: =LOG10(RC[-1]) -> 2.7793509596601065 | K208: =1.75*RC[-1] -> 4.8638641794051862 | L208: =11*LOG10(RC[-2]) -> 4.8833772935796009
A209: 1 | B209: 30 | C209: Source Code Management | D209: source-code-management | E209: /development/source-code-management | F209: =2.5*LOG10(RC[-4]+2) -> 3.7628749457997652 | G209: =ABS(RC[-5])/MAX(C[-5]) -> 6.2240663900414939E-2 | H209: =7*RC[-1] -> 0.43568464730290457 | I209: =10000*RC[-2] -> 622.40663900414938 | J209: =LOG10(RC[-1]) -> 2.794074216480813 | K209: =1.75*RC[-1] -> 4.889629878841423 | L209: =11*LOG10(RC[-2]) -> 4.9086173147566736
A210: 4 | B210: 31 | C210: C# 4.0 | D210: c--4-0 | E210: /development/software-development/net/c-/c--4-0 | F210: =2.5*LOG10(RC[-4]+2) -> 3.796284849694719 | G210: =ABS(RC[-5])/MAX(C[-5]) -> 6.4315352697095429E-2 | H210: =7*RC[-1] -> 0.450207468879668 | I210: =10000*RC[-2] -> 643.15352697095432 | J210: =LOG10(RC[-1]) -> 2.808314655595423 | K210: =1.75*RC[-1] -> 4.91455064729199 | L210: =11*LOG10(RC[-2]) -> 4.9329034303651893
A211: 0 | B211: 31 | C211: Event | D211: event | E211: /event | F211: =2.5*LOG10(RC[-4]+2) -> 3.796284849694719 | G211: =ABS(RC[-5])/MAX(C[-5]) -> 6.4315352697095429E-2 | H211: =7*RC[-1] -> 0.450207468879668 | I211: =10000*RC[-2] -> 643.15352697095432 | J211: =LOG10(RC[-1]) -> 2.808314655595423 | K211: =1.75*RC[-1] -> 4.91455064729199 | L211: =11*LOG10(RC[-2]) -> 4.9329034303651893
A212: 2 | B212: 32 | C212: SQL Server | D212: sql-server | E212: /development/database-development/sql-server | F212: =2.5*LOG10(RC[-4]+2) -> 3.828697292605638 | G212: =ABS(RC[-5])/MAX(C[-5]) -> 6.6390041493775934E-2 | H212: =7*RC[-1] -> 0.46473029045643155 | I212: =10000*RC[-2] -> 663.90041493775936 | J212: =LOG10(RC[-1]) -> 2.8221029400810562 | K212: =1.75*RC[-1] -> 4.9386801451418485 | L212: =11*LOG10(RC[-2]) -> 4.9563013631451245
A213: 4 | B213: 33 | C213: C# 3.0 | D213: c--3-0 | E213: /development/software-development/net/c-/c--3-0 | F213: =2.5*LOG10(RC[-4]+2) -> 3.8601701108756892 | G213: =ABS(RC[-5])/MAX(C[-5]) -> 6.8464730290456438E-2 | H213: =7*RC[-1] -> 0.47925311203319509 | I213: =10000*RC[-2] -> 684.64730290456441 | J213: =LOG10(RC[-1]) -> 2.8354669016390379 | K213: =1.75*RC[-1] -> 4.9620670778683165 | L213: =11*LOG10(RC[-2]) -> 4.9788704035277362
A214: 1 | B214: 33 | C214: VMware | D214: vmware | E214: /power-user/vmware | F214: =2.5*LOG10(RC[-4]+2) -> 3.8601701108756892 | G214: =ABS(RC[-5])/MAX(C[-5]) -> 6.8464730290456438E-2 | H214: =7*RC[-1] -> 0.47925311203319509 | I214: =10000*RC[-2] -> 684.64730290456441 | J214: =LOG10(RC[-1]) -> 2.8354669016390379 | K214: =1.75*RC[-1] -> 4.9620670778683165 | L214: =11*LOG10(RC[-2]) -> 4.9788704035277362
A215: 2 | B215: 34 | C215: Windows 7 | D215: windows-7 | E215: /power-user/windows/windows-7 | F215: =2.5*LOG10(RC[-4]+2) -> 3.8907562519182184 | G215: =ABS(RC[-5])/MAX(C[-5]) -> 7.0539419087136929E-2 | H215: =7*RC[-1] -> 0.49377593360995853 | I215: =10000*RC[-2] -> 705.39419087136923 | J215: =LOG10(RC[-1]) -> 2.8484318788034053 | K215: =1.75*RC[-1] -> 4.984755787905959 | L215: =11*LOG10(RC[-2]) -> 5.0006642138176449
A216: 1 | B216: 37 | C216: Windows | D216: windows | E216: /power-user/windows | F216: =2.5*LOG10(RC[-4]+2) -> 3.977661517566248 | G216: =ABS(RC[-5])/MAX(C[-5]) -> 7.6763485477178428E-2 | H216: =7*RC[-1] -> 0.53734439834024905 | I216: =10000*RC[-2] -> 767.63485477178426 | J216: =LOG10(RC[-1]) -> 2.8851546858281454 | K216: =1.75*RC[-1] -> 5.0490207001992546 | L216: =11*LOG10(RC[-2]) -> 5.0618601280790658
A217: 2 | B217: 39 | C217: Web Development | D217: web-development | E217: /development/software-development/web-development | F217: =2.5*LOG10(RC[-4]+2) -> 4.0319596417993386 | G217: =ABS(RC[-5])/MAX(C[-5]) -> 8.0912863070539423E-2 | H217: =7*RC[-1] -> 0.56639004149377592 | I217: =10000*RC[-2] -> 809.12863070539424 | J217: =LOG10(RC[-1]) -> 2.9080175687876495 | K217: =1.75*RC[-1] -> 5.0890307453783867 | L217: =11*LOG10(RC[-2]) -> 5.0995672858346142
A218: 1 | B218: 42 | C218: LifeHacker | D218: lifehacker | E218: /power-user/lifehacker | F218: =2.5*LOG10(RC[-4]+2) -> 4.1086316912154688 | G218: =ABS(RC[-5])/MAX(C[-5]) -> 8.7136929460580909E-2 | H218: =7*RC[-1] -> 0.60995850622406633 | I218: =10000*RC[-2] -> 871.36929460580905 | J218: =LOG10(RC[-1]) -> 2.9402022521590507 | K218: =1.75*RC[-1] -> 5.1453539412783389 | L218: =11*LOG10(RC[-2]) -> 5.1521492650541996
A219: 4 | B219: 46 | C219: C# 2.0 | D219: c--2-0 | E219: /development/software-development/net/c-/c--2-0 | F219: =2.5*LOG10(RC[-4]+2) -> 4.2031030934389682 | G219: =ABS(RC[-5])/MAX(C[-5]) -> 9.5435684647302899E-2 | H219: =7*RC[-1] -> 0.66804979253112029 | I219: =10000*RC[-2] -> 954.35684647302901 | J219: =LOG10(RC[-1]) -> 2.9797107934427243 | K219: =1.75*RC[-1] -> 5.2144938885247676 | L219: =11*LOG10(RC[-2]) -> 5.2159152551818107
A220: 3 | B220: 46 | C220: Visual Studio and tools | D220: visual-studio-and-tools | E220: /development/software-development/net/visual-studio-and-tools | F220: =2.5*LOG10(RC[-4]+2) -> 4.2031030934389682 | G220: =ABS(RC[-5])/MAX(C[-5]) -> 9.5435684647302899E-2 | H220: =7*RC[-1] -> 0.66804979253112029 | I220: =10000*RC[-2] -> 954.35684647302901 | J220: =LOG10(RC[-1]) -> 2.9797107934427243 | K220: =1.75*RC[-1] -> 5.2144938885247676 | L220: =11*LOG10(RC[-2]) -> 5.2159152551818107
A221: 1 | B221: 55 | C221: Database Development | D221: database-development | E221: /development/database-development | F221: =2.5*LOG10(RC[-4]+2) -> 4.3896871391812287 | G221: =ABS(RC[-5])/MAX(C[-5]) -> 0.11410788381742738 | H221: =7*RC[-1] -> 0.79875518672199164 | I221: =10000*RC[-2] -> 1141.0788381742739 | J221: =LOG10(RC[-1]) -> 3.0573156512553941 | K221: =1.75*RC[-1] -> 5.3503023896969397 | L221: =11*LOG10(RC[-2]) -> 5.3387430754919114
A222: 1 | B222: 61 | C222: Personal | D222: personal | E222: /about/personal | F222: =2.5*LOG10(RC[-4]+2) -> 4.4983513736339544 | G222: =ABS(RC[-5])/MAX(C[-5]) -> 0.12655601659751037 | H222: =7*RC[-1] -> 0.88589211618257258 | I222: =10000*RC[-2] -> 1265.5601659751037 | J222: =LOG10(RC[-1]) -> 3.1022827967719175 | K222: =1.75*RC[-1] -> 5.4289948943508559 | L222: =11*LOG10(RC[-2]) -> 5.4084952299538607
A223: 0 | B223: 67 | C223: About | D223: about | E223: /about | F223: =2.5*LOG10(RC[-4]+2) -> 4.5971227268431383 | G223: =ABS(RC[-5])/MAX(C[-5]) -> 0.13900414937759337 | H223: =7*RC[-1] -> 0.97302904564315362 | I223: =10000*RC[-2] -> 1390.0414937759338 | J223: =LOG10(RC[-1]) -> 3.1430277644619768 | K223: =1.75*RC[-1] -> 5.5002985878084596 | L223: =11*LOG10(RC[-2]) -> 5.4708303919229646
A224: 0 | B224: 84 | C224: Opinions | D224: opinions | E224: /opinions | F224: =2.5*LOG10(RC[-4]+2) -> 4.8362461281089191 | G224: =ABS(RC[-5])/MAX(C[-5]) -> 0.17427385892116182 | H224: =7*RC[-1] -> 1.2199170124481327 | I224: =10000*RC[-2] -> 1742.7385892116181 | J224: =LOG10(RC[-1]) -> 3.241232247823032 | K224: =1.75*RC[-1] -> 5.6721564336903061 | L224: =11*LOG10(RC[-2]) -> 5.6178116627602082
A225: 3 | B225: 118 | C225: C# | D225: c- | E225: /development/software-development/net/c- | F225: =2.5*LOG10(RC[-4]+2) -> 5.1979531151190619 | G225: =ABS(RC[-5])/MAX(C[-5]) -> 0.24481327800829875 | H225: =7*RC[-1] -> 1.7136929460580912 | I225: =10000*RC[-2] -> 2448.1327800829877 | J225: =LOG10(RC[-1]) -> 3.3888349690672759 | K225: =1.75*RC[-1] -> 5.9304611958677329 | L225: =11*LOG10(RC[-2]) -> 5.8305546188357997
A226: 2 | B226: 210 | C226: .NET | D226: net | E226: /development/software-development/net | F226: =2.5*LOG10(RC[-4]+2) -> 5.8158396523218778 | G226: =ABS(RC[-5])/MAX(C[-5]) -> 0.43568464730290457 | H226: =7*RC[-1] -> 3.0497925311203318 | I226: =10000*RC[-2] -> 4356.8464730290461 | J226: =LOG10(RC[-1]) -> 3.6391722564950699 | K226: =1.75*RC[-1] -> 6.3685514488663726 | L226: =11*LOG10(RC[-2]) -> 6.1710287425345944
A227: 2 | B227: 215 | C227: Delphi | D227: delphi | E227: /development/software-development/delphi | F227: =2.5*LOG10(RC[-4]+2) -> 5.8411493346213241 | G227: =ABS(RC[-5])/MAX(C[-5]) -> 0.44605809128630708 | H227: =7*RC[-1] -> 3.1224066390041494 | I227: =10000*RC[-2] -> 4460.5809128630708 | J227: =LOG10(RC[-1]) -> 3.6493914216767558 | K227: =1.75*RC[-1] -> 6.3864349879343223 | L227: =11*LOG10(RC[-2]) -> 6.1844249154088828
A228: 0 | B228: 345 | C228: Power User | D228: power-user | E228: /power-user | F228: =2.5*LOG10(RC[-4]+2) -> 6.3508236869771837 | G228: =ABS(RC[-5])/MAX(C[-5]) -> 0.71576763485477179 | H228: =7*RC[-1] -> 5.0103734439834025 | I228: =10000*RC[-2] -> 7157.6763485477177 | J228: =LOG10(RC[-1]) -> 3.8547720568344244 | K228: =1.75*RC[-1] -> 6.7458510994602428 | L228: =11*LOG10(RC[-2]) -> 6.4459857234436857
A229: 1 | B229: 433 | C229: Software Development | D229: software-development | E229: /development/software-development | F229: =2.5*LOG10(RC[-4]+2) -> 6.5962231423865934 | G229: =ABS(RC[-5])/MAX(C[-5]) -> 0.89834024896265563 | H229: =7*RC[-1] -> 6.2883817427385891 | I229: =10000*RC[-2] -> 8983.4024896265564 | J229: =LOG10(RC[-1]) -> 3.953440858114516 | K229: =1.75*RC[-1] -> 6.9185215017004031 | L229: =11*LOG10(RC[-2]) -> 6.5667277094243444
A230: 0 | B230: 482 | C230: Development | D230: development | E230: /development | F230: =2.5*LOG10(RC[-4]+2) -> 6.7121134041110313 | G230: =ABS(RC[-5])/MAX(C[-5]) -> 1 | H230: =7*RC[-1] -> 7 | I230: =10000*RC[-2] -> 10000 | J230: =LOG10(RC[-1]) -> 4 | K230: =1.75*RC[-1] -> 7 | L230: =11*LOG10(RC[-2]) -> 6.6226599046075867